NUMBER,QUESTION,OPTIONS,SOLUTION,IMAGE Q,ANSWER KEY,IMAGE A
Question 13,A child presents with bone pain and hepatosplenomegaly. A trephine biopsy and aspirate show the following finding. which of the following is the most likely enzyme deficient in this condition?,"a) Hexosaminidase
b) Glucocerebrosidase
c) sphingomyelinase
d) Alpha 1,4-glucosidase","The given clinical scenario of a child with bone pain, hepatosplenomegaly, and biopsy showing Gaucher's cell with a characteristic crumpled tissue paper appearance is suggestive of Gaucher's disease. The deficient enzyme is glucocerebrosidase (also known as beta-glucosidase).
Gaucher's disease is an inborn error of metabolism caused due to a deficiency of beta-glucocerebrosidase. It is the most common lysosomal storage disorder and the mode of inheritance is autosomal recessive. There is an accumulation of lipid-laden macrophages in the spleen, liver, and other tissues.
There are three clinical subtypes - type I (chronic non-neuronopathic), type II (acute neuronopathic), and type III (intermediate). clinical features include anemia, thrombocytopenia, hepatosplenomegaly, and neurological features depending on the subtype.
Gaucher's cells - These are formed as a result of the accumulation of massive amounts of glucocerebrosides within the phagocytes. The cells have a fibrillary cytoplasm and give a crumpled tissue paper appearance.
option A: Deficiency of hexosaminidase A is seen in Tay-Sachs disease. The deficiency of beta-hexosaminidase A and B causes Sandhoff's disease. clinical features are seizures, macrocephaly, and hyperacusis.
option c: Deficiency of sphingomyelinase leads to Niemann-pick disease. It is characterized by the presence of foam cells in the bone marrow. There may be pulmonary infiltrates leading to lung failure.
option D: pompe's disease (type 2 glycogen storage disease) occurs due to alpha 1,4-glucosidase (acid maltase) deficiency. It is the only glycogen storage disease that is a lysosomal storage disease and causes lysosomal glycogen accumulation in cardiac, skeletal, and smooth muscle cells. The clinical symptoms of pompe disease are hypotonia (floppy infant), skeletal muscle weakness, hepatomegaly, hypertrophic cardiomyopathy, and macroglossia.",888-689.PNG,B,IMAGE A
Question 14,"A child presents with thinning of hair and scaling of the scalp. on taking further history, it is found that she consumes raw eggs in her diet regularly. The given manifestations are due to the deficiency of which of the following vitamins?","a) Niacin
b) pyridoxine
c) Biotin
d) Thiamine","The given clinical scenario of scaling and alopecia and the history of raw egg consumption are suggestive of biotin deficiency.
Raw egg white contains a glycoprotein known as avidin, which tightly binds to biotin and renders it unabsorbable from the intestine. Hence, there can be a biotin deficiency state.
Biotin deficiency may cause:
• Dermatitis, scaling, seborrheic, and erythematous rash
• Mental status changes (depression, hallucinations)
• Hyperesthesia
• Alopecia
• Atrophic glossitis
In infants, biotin deficiency presents as hypotonia, lethargy, and apathy. In addition, infants may develop alopecia and a characteristic rash that includes the ears.",,C,
Question 15,"A child presents with mental retardation, bone pain, and inability to walk. on funduscopy examination, a cherry red spot is seen. There is no organomegaly. what is the most likely diagnosis?","a) Tay-sachs disease
b) Niemann-pick disease
c) Hurler syndrome
d) Gaucher disease","The given clinical scenario, along with the fundoscopy image showing a macular cherry-red spot, indicates that the most likely diagnosis is Tay-sachs disease.
Tay-sachs disease is a lysosomal storage disease caused by the deficiency of β-hexosaminidase. It can present during infancy with macrocephaly, increased startle reaction, gradual loss of motor skills, and a macular cherry-red spot. Affected children usually die by the age of 1o–15 years.
It is of two types—juvenile-onset and adult-onset. The symptoms of the juvenile-onset form include ataxia and dementia. Dysarthria, lower motor neuron signs, and psychiatric disorders are common in the adult-onset type.
other options:
options B - Niemann-pick disease is an autosomal recessive inborn error of lipid metabolism. It results due to the deficiency of the sphingomyelinase enzyme. This results in the accumulation of sphingomyelin in the brain, lungs, liver, and spleen. The clinical features include a combination of hepatosplenomegaly, developmental delay, failure to thrive, severe psychomotor regression, interstitial lung disease, and a cherry-red spot in the macula.
option C - Hurler syndrome (mucopolysaccharidosis I) is an autosomal recessive condition that affects multiple organs. presentation is usually at 6–24 months with corneal clouding, coarse facial features, joint stiffness, and skeletal dysplasia. Glaucoma, retinal degeneration, and nasal discharge are the other features. The condition is generally fatal.
option D - Gaucher disease is a glycolipid storage disorder that can present with hepatosplenomegaly, mental retardation, and erosion of long bones. It is caused by the deficiency of β-glucosidase. The Gaucher cell has a wrinkled-paper appearance due to intracytoplasmic inclusions, which is a characteristic feature.",,A,IMAGE Q
