number,question,options,solution,image_q,answer_key,image_a
Q15,"The table given below shows a multivariate analysis of the relation between the risk of
developing blindness and age, literacy rate, residence, and gender. which of the following is true?","a)2 and 3
b)1 and 3
c)1 and 2
d)3 and 4","The correct statements drawn from the values given in the table are 3 and 4.
An odds ratio is a measure of the association between an exposure and an outcome. It represents the odds that an outcome will occur given a particular exposure in comparison to the odds ofthe outcome occurring in the absence of that exposure.
An odds ratio of 1 indicates that the risk factor is not related to the disease.
An odds ratio of less than 1 indicates that a person with the disease is less likely to have been exposed to the factor, implying that the factor may be a protective factor against the disease.
An odds ratio greater than 1 indicates that the odds ratio is significant, and the factor can be ascertained as a risk factor.
The p-value is the probability of obtaining a result at least as extreme as the one that was actually  observed in the biological or clinical experiment. A p-value of less than o.o5 indicates that the test result is statistically significant.
other options:
statement 1: Female population is at greater risk of developing blindness is a false statement;
since the odds ratio is &lt;1, the female population will be at lesser risk of developing blindness than the male population.
statement 2: people dwelling in rural areas are at increased risk of developing blindness is also false; a p-value of &gt;o.o5 means that this association is not statistically significant.",,D,
Q16,A patient with lymphatic filarisis is being managed as shown in the image below. what is the level of prevention done here?,"a)specific protection
b)Disability limitation
c)primary prevention
d)Health promotion","The image shows an established case of chronic lymphatic filariasis, where hygiene is being
maintained to prevent further disability by secondary bacterial infection. Disability limitation is a mode of intervention in tertiary prevention.



other options:
option A: specific protection is a mode of intervention in primary prevention which aims at
limiting the number of cases of a particular disease. This includes immunization, use of specific nutrients, chemoprophylaxis, accident protection, and avoidance of allergens.
option C: primary prevention is a level of prevention which is defined as action taken prior to the onset of a disease, which removes the possibility that a disease will ever occur. It is accomplished  by measures designed to promote general health and well-being.
option D: Health promotion is a mode of intervention in primary prevention, and is the process of enabling people to increase control over, and improve health. Health promotion may be achieved   through health education, environmental modification, nutritional interventions or lifestyle
changes.",2537-1593.PNG,B,
Q17,which of the following indicators can help in determining whether the health system is giving importance to identifying leprosy in the community?,"a)Treatment completion rate
b)Annual new case detection rate per lac
c)Treatment initiation rate
d)proportion of newly diagnosed patients with grade-2 disability","The proportion of newly diagnosed patients with grade 2 disability is useful in determining whether the health system is giving importance to identifying leprosy in the community.
The National Leprosy Eradication programme (NLEp) was introduced in 1983. The strategy of     NLEp is to control the disease through a reduction in the infection and the infective source, thus breaking the chain of disease transmission. It functions under National Health Mission (NHM).
The vision of the NLEp is 'Leprosy-free India'. Disability prevention and medical rehabilitation
(DpMR) is the priority of the programme. The mission of  NLEp is to provide quality services free of cost to all people through the integrated healthcare system.
Main indicators for evaluating case detection:
• proportion of grade-2 disabilities among new cases
• proportion of females among new cases
• proportion of MB among new cases
• proportion of child (o-14 years) among new cases
• Child rate per 1,oo,ooo population
• scheduled caste new case detection rate
• scheduled tribe new case detection rate",,D,
Q18,which of the following is true regarding the vaccine vial monitor (VVM)?,"a)3,4
b)1,2
c)1, 2, 3, 4, 5
d)5,6","The correct statements are 1 and 2.
Vaccine vial monitors (VVM) are heat-sensitive indicators routinely used to monitor heat exposure of the vaccine and determine vaccine viability as the vaccine vial moves across the supply chain.
It records cumulative heat exposure through a gradual change in color.



If the color of the inner square is the same or is darker than the outer circle, it indicates that the vaccine has been exposed to high temperatures and should be discarded.
A VVM can be used to assess vaccine potency and not vaccine efficacy. Vaccine potency is the
ability of the vaccine to provide adequate immunity to the patient. Vaccine potency is irreversibly lost when the vaccine is exposed to unfavorable temperatures; hence, VVM indicating heat
exposure can be used to assess whether the vaccine potency is likely to be intact or not. Vaccine
efficacy, on the other hand, is a measure of the immunity conferred by the vaccine or the ability of the vaccine to prevent the disease in a vaccinated person under ideal conditions, such as clinical
trials. The term vaccine efficacy is used in relation to findings of clinical trials, whereas the term vaccine potency is used for regular usage of the vaccine. Vaccine efficacy is determined only
during clinical trials, whereas vaccine potency is tested for every batch of the vaccine that is manufactured.
There are currently 4 types of VVMs; they are chosen to match the heat sensitivity of the vaccines based on the VVM number:
• VVM 3o: High stability
• VVM 14: Medium stability
• VVM 7: Moderate stability
• VVM 2: Least stable
purpose of VVMs:
• Ensures that vaccines damaged by heat are not administered.
• Decision on which vaccines to be kept after a cold chain break occurs, minimizing unnecessary vaccine wastage.
• Decision on which vaccine is to be used first. Vaccines showing significant heat exposure should be used before those that show lower heat exposure, even if their expiry date is longer.
The expiry date of a vaccine cannot be relaxed even ifVVM is in an acceptable range. Expired
vaccines must be discarded. The expiry date of a vaccine cannot be determined using a VVM as it does not monitor the vaccine components. It only ensures that the vaccines have been exposed to the required temperatures and are viable for use.
There are two different locations for VVMs:
• on the label of the vaccine: The vaccine vial, once opened, can be kept for subsequent immunization sessions for up to 28 days, regardless of the formulation of the product.
• In a location other than on the label (e.g., cap or neck of ampoule): The vaccine vial, once opened should be discarded at the end of the immunization session or within six hours of opening,
whichever comes first, regardless of the formulation of the product.",,B,
Q19,which of the following models of disease causation is depicted in the image below?,"a)sufficient component cause model
b)Epidemiological triad
c)PERT model
d)web of causation model","The model of disease causation depicted below is a sufficient component cause model.
It was developed by Rothman based on the idea that an outcome can only happen when a
sufficient cause is present. A disease can have multiple sufficient causes. But, each sufficient cause



can consist of a pie chart of component causes, a causal pie.  one component cause can be a part    of more than one sufficient cause. A component cause can be considered necessary if it is a part of a disease's sufficient causes.
In the given model, each pie chart represents a sufficient cause made of component causes. since B is present in all the charts, it can be considered a necessary cause. All the others are
contributing causes.
other options:
option B: An epidemiological triad depicts the interrelationship between the causative agent, the host, and the environment. All of them contribute to disease development. The aim of an
epidemiological triad is to identify how to break this relationship and prevent the outbreak of the disease.
option C: PERT is used for network analysis. It is a type of quantitative management technique that helps in detailed planning and comprehensive supervision.
option D: The web of causation considers all the predisposing factors and their complex
interrelationship with each other. This model is ideally suited to study chronic disease. The web of causation does not imply that the disease is controlled only when all the multiple chains of
causation are removed. sometimes removal of one significant link is sufficient
to control the disease.",2538-1594.PNG,A,
Q20,Attributable risk calculated to understand the relation between smoking and lung cancer is 9o%. which of the following is true?,"a)1o% cases of lung cancer can be eliminated in smokers if smoking is eliminated
b)9o% cases of lung cancer can be eliminated in population if smoking is eliminated
c)9o% cases of lung cancer can be eliminated in smokers if smoking is eliminated
d)1o% cases of lung cancer can be eliminated in population if smoking is eliminated","Attributable risk (AR) describes the extent of outcome (lung cancer) that can be attributed to     exposure (smoking). In the given scenario, an AR of 9o% means that 9o% of lung cancer cases among smokers are attributable to smoking. Therefore, 9o% cases of lung cancer can be
eliminated in smokers if smoking is eliminated.
AR is the difference in incidence rates of disease between an exposed group and an unexposed
group. AR is indicative of the extent of the disease attributed to the exposure. It also refers to the  amount of disease that could be eliminated in the exposed persons if the exposure is controlled or eliminated. It also helps to determine the impact a successful preventive or public health program might have in case the exposure to cause is reduced or eliminated.
Population-attributable risk (PAR) is the difference in the incidence of disease in the total
population and the incidence of disease among those not exposed to the supposed cause. PAR is     useful in providing an estimate of the amount by which the disease could be reduced in that whole population if the suspected factor was eliminated or modified.
For example, a PAR of 9o% in the context of smoking and lung cancer means that 9o% cases of lung cancer in the population can be attributed to smoking.
Relative risk is defined as the ratio of incidence of the disease (outcome) among exposed and unexposed groups. It helps in establishing the association between a cause and a disease.
However, it does not help in assessing the extent of the cause bringing about the disease (outcome).",,C,
Q21,"Following an earthquake, the building codes were changed to earthquake-resistant buildings. which of the following step of disaster management does this fall under?","a)Disaster response
b)Disaster reconstruction
c)Disaster rehabilitation
d)Disaster mitigation","The measures that are taken to prevent disasters from causing emergencies or to lessen the likely effects of emergencies are part of disaster mitigation.
Disaster mitigation measures aim to reduce the vulnerability of the system. It complements
disaster preparedness and response activities and includes measures taken to lessen the likely effects of emergencies. some of these measures are:
• Flood mitigation
• Land-use planning
• Improved building codes
• Reduction and protection of vulnerable populations or structures.
other options:
option A - Disaster response includes activities such as rescue and first aid, field care, triage and tagging that form a part of the emergency care needed in the first few hours after a disaster.
option B - Disaster reconstruction is a part of the recovery phase after a disaster.
option C - Disaster rehabilitation refers to measures that lead to the restoration of pre-disaster conditions. These measures include water supply restoration, food safety, basic
sanitation, personal hygiene, and vector control.
The disaster management cycle is given below:",,D,2558-1601.PNG
Q22,which of the following statements are true regarding drugs used in anti-tubercular treatment?,"a)A, B, C, D
b)B, C
c)A, C
d)A, D","Isoniazid inhibits mycolic acid synthesis and Bedaquiline inhibits ATP synthase. other options:



pyrazinamide is not an enzyme inducer. pyrazinamide is converted into its active form pyrazinoic acid. pyrazinoic acid disrupts mycobacterial cell membrane metabolism and transport functions.
Amongst the anti-tubercular drugs, rifampicin is an enzyme inducer.
Rifampicin can be used in treatment of meningococcal carriers, prophylaxis in contacts
with Haemophilus influezae type b, and serious staphylococcal infections.",,D,
Q23,which of the following criteria should be satisfied to start MDT?,"a)1,4
b)1,3
c)1,3,4
d)1,2,3,4","To start multidrug therapy (MDT), the criteria that should be satisfied are a hypopigmented patch with sensory loss and peripheral nerve thickening with sensory loss.
Leprosy (Hansen's disease) is a chronic infectious disease caused by Mycobacterium leprae. It mainly affects the skin and peripheral nerves. The disease has two polar forms, lepromatous   leprosy, and tuberculoid leprosy, lying at the two ends of a long spectrum of the disease.
Leprosy is diagnosed by the detection of at least one of the following cardinal signs:
• Definite loss of sensation in a pale hypopigmented patch
• Thickened or enlarged peripheral nerve, with loss of sensation and/or weakness of the muscles supplied by that nerve (statement 2)
• presence of acid-fast bacilli in a slit-skin smear.
However, a skin smear is not a prerequisite for implementing MDT. since MDT has been
introduced, many procedures have been simplified, so that leprosy patients can be detected by health workers in the field and MDT can be immediately started.",,B,
Q24,Match the following stages with their relevant descriptions.,"a)1-c, 2-d, 3-a, 4-d
b)1-d, 2-b, 3-a, 4-c
c)1-b, 2-d, 3-c, 4-d
d)1-a, 2- c, 3-d, 4-b","The correct match is 1-d, 2-b, 3-a, and 4-c.
Natural history of disease refers to the progression of a disease in an individual over time, in the absence of treatment. It has two phases, a period of pre-pathogenesis and a period of
pathogenesis.





The period of pre-pathogenesis is before the onset of disease in humans. An interaction between  the agent, host and the environment occurs in this phase before the pathogenesis. It starts with    appropriate exposure to or accumulation of factors sufficient for the disease process to begin in a susceptible host. The exposure is a microorganism in an infectious disease. For lung cancer, it is  any factor that initiates the process, such as asbestos fibres or components in tobacco
smoke. primary prevention (health promotion and specific protection) is applicable in this period. The period of pathogenesis starts after the disease process has been triggered and pathological
changes occur without the individual being aware of it. It begins with the entry of
the organism till recovery, death, or disability. The subclinical or asymptomatic
period between exposure and onset of symptoms is called the incubation period for infectious diseases, and the latency period for chronic diseases. The onset of clinical symptoms is the
beginning of the clinical stage of the disease. secondary (halting of the disease process) and tertiary prevention (measures to limit disability) are applicable in this period.
Rehabilitation has been defined as the use of medical, social, educational, and vocational
measures for training the individual to the highest possible level of functional ability. It is a part of tertiary prevention like providing callipers for walking patients and arranging schooling after  being affected by polio.",,B,
Q25,contraceptive failure is assessed using which of the following methods?,"a)pharmacological index
b)pearl index
c)performance index
d)Efficacy index","pearl index is the common method used to measure contraceptive failure rate.
It is defined as the number of failures per 1oo woman-years of exposure (HWY). This rate is given by the formula:
pearl index = Total accidental pregnancies x 12oo/Total months of exposure",,B,
Q26,Match the following scientists with their discoveries:,"a)1-a, 2-b, 3-a
b)1-b, 2-a, 3-c
c)1-c, 2-b, 3-a
d)1-b, 2-c, 3-a","The correctly matched pairs are as follows:
• walter Reed showed that yellow fever is transmitted by the Aedes mosquito.
• Edward Jenner - smallpox vaccination
• James Lind - prevention of scurvy by intake of citrus fruits

scientist/ Doctor	Achievements
susruta	Father of Indian surgeryFath er of plastic and cosmetic su rgeryAuthor of “sushruta sa   mhita”
Hippocrates	First True EpidemiologistFat her of MedicineAuthor of “Ai rs, water and place”
charaka	Father of Indian MedicineAu thor of “charaka samhita”
Avicenna	Author of “canon of Medicin   e” and “The Book on Healing”
Andreas vesalius	Father of Modern AnatomyA uthor of “Fabrica”
Hammurabi	Author of “Babylonian code of Hammurabi”
John snow	Father of Epidemiology
Louis pasteur Robert koch / Ferdinand cohn	Father of Bacteriology
samuel Hahnemann	Father of Homeopathy",,D,
Q27,Identify the formula given below:,"a)standard deviation
b)standard error
c)Median
d)variance","The formula given above is used to calculate the standard deviation.
standard deviation (or σ) is a measure of how dispersed the data is in relation to the mean. Data clustered around the mean have a low standard deviation, while data that are more spread out
have a high standard deviation. A standard deviation close to zero indicates that data points are    close to the mean, whereas a high or low standard deviation indicates data points are respectively above or below the mean.
standard error 〓 sD/√n, where sD is the standard deviation and n is the sample size
standard error will reduce when the sample size is increased.
The median divides the frequency distribution in half when all the scores are listed in order.
when a distribution has an odd number of elements, the median is the middle value. when the     distribution has an even number of elements, the median is the average of the two middle scores.
variance is the mean of the squares of all the deviation scores of the distribution.",2541-1595.PNG,A,
Q28,"A child presents with a dog bite from a street dog. on examination, an abrasion of 1.5 cm is present, with slight oozing. which of the following statements are correct?","a)2, 3, 5, 6
b)1, 2, 5, 6
c)1, 2, 3, 5
d)1, 2, 3, 6","A child presenting with abrasion with slight oozing after a dog bite comes under category III. The correct statements are 1, 2, 3, and 6.
The following measures should be taken immediately to stop the contraction of rabies:
• cleansing: The most important step in the prevention of rabies is washing the affected area with plenty of soap and water under a running tap for 15 minutes. This is a standard procedure that
minimizes the contraction of rabies.
• chemical treatment: After washing and drying the wound, disinfectants like povidone-iodine and spirit can be applied.
• suturing: Bite wounds are not sutured generally. If suturing is unavoidable, rabies
immunoglobulin should be infiltrated in the depth and around the wound, and suturing should be delayed by a few hours.
• In unavoidable situations, minimal loose sutures may be applied to arrest bleeding.
• other measures: Local antibiotics and tetanus toxoids should be given.
Different wound categories for post-exposure prophylaxis:
post-exposure prophylaxis regimen for rabies:
Intramuscular regimen: In this regimen, 1 ml or o.5 ml of vaccine is injected into the deltoid in patients with category II and III wounds.
• Essen regimen: A 5-dose regimen in which 1 dose of vaccine is given on days o, 3, 7, 14, and 28.
• zagreb regimen: A 4-dose multisite regimen in which 2 doses of vaccine are given on day o, followed by 1 dose on days 7 and 21.
Intradermal regimen: In this regimen, o.1 ml of injection is given at 2 sites on days o, 3, 7, and 28. Equine Rabies Immunoglobulin at a dose of 4o IU/kg (a maximum of 3ooo IU) body weight is
given once. It is given to all category III bites and also category II bites in the case of
immune-compromised persons.

categories of wound	post-exposure prophylaxis
category I- touching or feedi   ng animals, licks on intact ski n	None
category II- nibbling of unco vered skin, minor scratches,   or abrasionswithout bleeding	Immediate vaccination andlo cal treatment of the wound
category III- single or multip  le transdermal bites or scratc  hes, licks on broken skin cont acts with bats	Immediate vaccination anda  dministration of rabiesimmu  noglobulin; localtreatment of the wound",,D,
Q29,water from a broken septic tank is collected in a container and breeding mosquitoes are seen. The image of the larva is given below. Identify the species of the mosquito.,"a)Anopheles
b)Aedes
c)Mansonia
d)culex","The species of mosquito that breeds in dirty water is Culex.
Culex fatigans are found everywhere in India and they transmit Bancroftian
filariasis. Culex mosquitoes are also vectors for Japanese encephalitis, west Nile fever, and viral arthritis.
It can be identified by the presence of unspotted wings and hunched back. The larva has a head that is suspended downwards at an angle to the water surface and a siphon tube is present.
It breeds in dirty water collections like stagnant drains, septic tanks, and burrow pits. The peak biting time is during midnight. The preferred biting site is the legs, mainly below the knee.",2542-1597.PNG,D,
Q30,The drug shown in the image below is administered for:,"a)Malaria
b)Dengue
c)Sexually transmitted infections
d)AIDS","The image given below shows artemisinin-based combination therapy (ACT), which is used in the treatment of falciparum malaria.
ACT consists of artesunate given for 3 days and sulphadoxine-pyrimethamine given for 1 day. It is supplied by the government of India under the national vector-borne disease control program
(NVDCp).
It is given to all confirmed cases of plasmodium falciparum infection, found positive by
microscopy or rapid diagnostic tests. primaquine with dose of o.75 mg/kg of body weight is given   on day 2 along with it. Artemether-lumefantrine is used for the treatment of falciparum malaria in the northeastern states of India.
This drug is not given in pregnancy and in children less than 5 kg of body weight.",2542-1596.PNG,A,
Q31,"under the Anemia Mukt Bharat initiative, mild to moderate anemia in pregnant women &lt;
34 weeks of gestation is treated using:","a)3 iron and folic acid (IFA) tablets, taken OD
b)IV iron sucrose for non-compliance with oral tablets
c)2 iron and folic acid tablets OD + IV iron sucrose
d)IM ferric carboxy maltose (FCM)","According to the Anemia Mukt Bharat initiative, pregnant women with mild and moderate anemia is treated with
• Two iron and folic acid tablets (6o mg elemental iron and 5oo mcg folic acid) daily, orally given by the health provider during the ANC contact
• parenteral iron (IV iron sucrose or ferric carboxy maltose [FCM]) may be considered as the first line of management in pregnant women who are detected to be anemic late in pregnancy or in
whom compliance is likely to be low (high chance of loss to follow-up)
Anemia Mukt Bharat 2o18 scheme:
This is an initiative that aims to strengthen the existing mechanisms and foster newer strategies  for tackling anemia. It focuses on six target beneficiary groups, through six interventions and six institutional mechanisms to achieve their target by 2o22.



Interventions:
• prophylactic iron and folic acid supplementation.
• Deworming.
• Intensified year-round Behaviour change communication campaign (solid Body, smart Mind) including ensuring delayed cord clamping in newborns.
• Testing of anemia using digital methods and point-of-care treatment.
• Mandatory provision of Iron and Folic Acid fortified foods in government-funded health programs.
• Addressing non-nutritional causes of anemia in endemic pockets, with a special focus on malaria, hemoglobinopathies, and fluorosis.
Beneficiaries:
• children, 6-59 months of age
• children, 5-9 years of age
• Adolescent girls and boys, 1o-19 years of age
• women of reproductive age, 2o-49 years of age
• pregnant women
• Lactating mothers, o-6 months
Institutions through which activities are carried out:
• Intra-Ministerial coordination
• National Anemia Mukt Bharat unit
• National centre of Excellence and Advanced Research on Anemia control (NcEAR-A)
• convergence with other Ministries
• strengthening supply chain and Logistics
• Anemia Mukt Bharat Dashboard and Digital portal",,B,
