number,question,options,solution,image_q,answer_key,image_a
Q14,A 35-year-old female patient presents with dyspnea and palpitations. ECG is given below. which of the following is false about her condition?,"a)Is a rare finding in a morphologically normal heart
b)Treated with intravenous digoxin to control ventricular rate
c)should be treated with cardioversion in all cases
d)Difference in pR and HR can be used to diagnose","In this patient presenting with palpitations, and irregular RR intervals with absent P waves on  ECG, the most likely diagnosis is atrial fibrillation. The false statement is that atrial fibrillation should be treated with cardioversion in all cases.
Cardioversion, whether electrical or pharmacological, is not always appropriate for every patient    with AF. The decision to perform cardioversion depends on several factors, including the duration of the AF episode, the presence of underlying heart disease, the patient's symptoms, and the risk    of thromboembolism. In some cases, rate control and anticoagulation may be the preferred
treatment approach rather than attempting to restore sinus rhythm immediately. Therefore, while cardioversion is a treatment option for some patients with AF, it is not universally indicated for all cases.
Atrial fibrillation (AF) is a supraventricular tachycardia caused by ectopic foci or small reentry circuits within the atria. It has an atrial rate of 4oo-6oo/min and a ventricular rate of
1oo-16o/min.
Risk factors for developing AF include:
• Age- usually above 6o years of age
• underlying heart disease
• Hypertension
• Diabetes mellitus
• obesity
• sleep apnea
• Post-cardiac surgery
• Inflammatory pericarditis
• Acute alcohol consumption
Features include heart rate typically ranges from 11o-16o beats/minute. It is irregular and rapid.   Presyncope and syncope can be seen. Thrombus formation can occur and thromboembolic events can take place.
Typically, ECG shows an absent P wave and irregular RR intervals.
Management is mainly by control of rate and rhythm, avoiding the thromboembolism risk and modifiable risk factors.
other options:
option A: Atrial fibrillation is usually seen in a patient with underlying heart disease and is a rare occurrence in morphologically normal hearts.
option B: Intravenous digoxin can be used to control the ventricular rate in atrial fibrillation,
especially in patients with heart failure or those who are not suitable for beta-blockers or calcium channel blockers. However, digoxin is not always the first-line treatment for rate control.
option D: The difference between the pulse rate (PR) and the heart rate (HR) can indeed be used to diagnose atrial fibrillation. This discrepancy, known as a pulse deficit, occurs because not all    heartbeats result in a palpable pulse due to the irregular and often rapid ventricular response.",4536-2846.PNG,C,
Q15,A patient presents with cough and hemoptysis and is diagnosed with pulmonary aspergillosis. He was treated with voriconazole. which of the following is false about voriconazole?,"a)It should be taken on an empty stomach
b)Therapeutic drug monitoring is required
c)It can be combined with pyrazinamide
d)A loading dose should be given","voriconazole should not be combined with pyrazinamide. This is because, both these drugs are hepatotoxic and can cause fulminant liver failure if combined together. Thus, this is false with   regards to voriconazole.
voriconazole is an azole antifungal used in the management of pulmonary aspergillosis. It is also the drug of choice for invasive aspergillosis, disseminated infections caused by
fluconazole-resistant Candida, Fusarium infections, and febrile neutropenia not responding to antibacterial therapy.
patients who are started on voriconazole should initially receive a loading dose of 6mg/kg body
weight for 24 hours followed by 3-4mg/kg body weight for 12 hours.  After this, patients can be
shifted to oral administration of the drug. voriconazole is metabolized by the cytochrome p45o
group of enzymes and thus its blood levels should be monitored. This is especially indicated in
patients with liver disease to adequately titrate the drug dosage.(option B). patients are advised to take the drug on an empty stomach as fatty meals reduce the absorption of the drug(option A)
other adverse effects of voriconazole include rashes, photosensitivity, transient visual or auditory  hallucinations and anaphylactoid reactions. Intravenous voriconazole should be used with caution in patients with renal failure.",,C,
Q16,A patient with a history of sore throat was treated with antibiotics. He now presents with facial swelling. urine examination shows eosinophilia and wBC casts. what is the likely   diagnosis?,"a)Acute interstitial nephritis
b)Lupus nephritis
c)pyelonephritis
d)post streptococcal glomerulonephritis","In this patient with a history of antibiotic use, after a sore throat presenting with facial swelling and WBC casts in the urine, the likely diagnosis is acute interstitial nephritis(AIN) likely
secondary to penicillin use.
AIN usually occurs as an allergic response to certain medications. offending agents include  beta-lactam antibiotics like methicillin, nonsteroidal anti-inflammatory drugs, proton pump
inhibitors, sulfonamide derivatives, diuretics, antiepileptics (phenytoin, valproate), and sulfasalazine.
Individuals with AIN are usually asymptomatic and are incidentally found to have elevated
creatinine. However, in some instances, they can develop fever and rash. In severe cases, renal failure with proteinuria can occur.
Laboratory studies may show peripheral eosinophilia and urinary eosinophilia. However, these are not specific or sensitive enough to serve as diagnostic criteria.
Treatment depends on how severe AIN is. Milder cases can be treated by stopping the offending drug. More severe cases require hospitalization and follow-up.",,A,
Q17,which of the following is a worrisome feature in a patient presenting with headache?,"a)1,2,3
b)1,2,3,4
c)1,2,4
d)3,4","statements 1,2,3 are indications for further evaluation of a headache



In a patient presenting with a headache, the following features are worrisome:
• Tenderness over the temporal area: This is a worrisome feature because it may indicate temporal arteritis (giant cell arteritis), a condition that requires prompt diagnosis and treatment to prevent  complications such as vision loss.
• subacute onset, worsening over 2 weeks: This is concerning as it suggests a progressive
underlying condition, which could be indicative of serious issues such as a tumor, an expanding  subdural hematoma, infection, or other intracranial processes that require further investigation.
• Age of 5o years: Age is a significant factor because the incidence of secondary headaches due to serious underlying causes increases with age. Conditions such as temporal arteritis and
intracranial neoplasms are more common in older adults.
In contrast, a history of cocaine abuse is not specifically a worrisome feature in the context of the  headache itself. while cocaine abuse can lead to headaches due to its vasoconstrictive properties   and potential to cause hypertensive emergencies or strokes, it is not a primary red flag feature for serious underlying causes of headaches in the same way as the other listed factors. However, a
history of cocaine abuse does warrant attention for other potential health risks and complications associated with drug use.",,A,
Q18,which of the following conditions is cannabinoid oil not indicated in?,"a)Lennoux gustaut
b)Dravet syndrome
c)Tuberous sclerosis
d)Rett syndrome","Cannabinoid oil is not indicated in Rett syndrome.
The FDA recently approved cannabidiol oral solution for the treatment of seizures associated with tuberous sclerosis complex in patients one year of age and older. It was previously approved for     the treatment of seizures associated with Lennox-Gastaut syndrome and Dravet syndrome.
Cannabinoid oil is an oral derivative of the cannabis plant. The mechanism by which it improves seizure threshold is not understood yet and there are various studies ongoing to survey its use.    The cannabinoid receptors are G protein-coupled receptors located predominantly in the
presynaptic nerve terminals.
The CB1 receptor is located in the central nervous system. Activation of CB1 receptor results in euphoria and alleviation of pain (anti-nociceptive effect). The CB2 receptor is located mainly in the periphery and their activation does not have a euphoric effect.
The endogenous cannabinoid system is a potential target for use in the treatment of chronic pain. The most common adverse effects of CBD at doses used for treating epilepsy include somnolence, fatigue, decreased appetite, diarrhea, and elevated hepatic transaminases. The elevations in liver   transaminases are dose-related.",,D,
Q19,"ABG findings of a person presenting with abdominal pain and vomiting are as follows. pH
7.31, HCO3-2o,Na 135, K+ 5, Cl- 92. Blood glucose is 45omg/dL. what is the interpretation?","a)High anion gap respiratory acidosis
b)Normal anion gap metabolic acidosis
c)High anion gap metabolic acidosis
d)Normal anion gap respiratory acidosis","The ABG findings of a person presenting with abdominal pain and vomiting, showing a pH of
7.31, HCO3- of 2o mEq/L, Na+ of 135 mEq/L, K+ of 5 mEq/L, Cl- of 92 mEq/L, and a blood glucose level of 45o mg/dL, with an anion gap of 23 indicate a high anion gap metabolic acidosis likely
secondary to a diabetic ketoacidosis state.



Anion Gap=Na+ - (cl- + HcO3-), so Anion Gap=135-(92+2o)=135-112=23
The low pH and low bicarbonate confirm acidemia with a metabolic component. The significantly elevated blood glucose level, along with symptoms of abdominal pain and vomiting, strongly
suggests diabetic ketoacidosis (DKA) as the underlying cause.",,C,
Q20,"A farmer presents with high grade fever, rash, vomiting, retro orbital pain and myalgia since 5 days is suspected to have dengue hemorrhagic fever. which of the following investigations  can be done for the diagnosis?","a)RTPCR for viral detection
b)NS1 antigen
c)IgM ELISA
d)viral isolation of Aedes albopictus ■(C6/36) culture","The given clinical scenario is of a farmer with suspected dengue hemorrhagic fever. As he has   presented 5 days after the onset of symptoms, the most appropriate test for him would be IgM ELISA. NS1 antigen is the preferred test had he presented before 5 days.
Dengue is an acute febrile illness caused by the dengue virus that is transmitted by the Aedes aegypti mosquito.
It presents as sudden-onset fever, retroorbital pain, myalgia, arthralgia, and a rash. The initial
rash in dengue may appear as flushing erythema of the face in the first 2 days of symptoms. A
second rash occurs 3-6 days after the onset of fever and appears maculopapular or morbilliform. Sometimes, lesions may coalesce and appear as 'white islands in a red sea' due to generalized
erythema with petechiae and islands of sparing.
Before day 5 of illness, during the febrile period, dengue infections may be diagnosed by detection of viral antigens like non-structural viral protein antigen(NS 1) by ELISA or rapid tests. This is
considered the mainstay of diagnosis.
virus isolation in cell culture and viral RNA detection by nucleic acid amplification tests (NAAT) can also be done.
Serological tests, such as IgM ELISA, are performed after day 5 when dengue viruses and antigens are no longer present in the blood due to the appearance of specific antibodies.",,C,
Q21,which of the following are features of upper motor neuron lesions?,"a)1, 2, 3
b)1, 4
c)3, 4, 5
d)2, 5","Spasticity and exaggerated reflexes are features of an upper motor neuron lesion.
Fasciculations and severe muscle atrophy are features of lower motor neuron lesions.
Rigidity is a feature of extrapyramidal lesions.",,D,
Q22,which of the following is not associated with celiac disease?,"a)IgA transglutaminase positive
b)IgG antigliadin positive
c)Modified Marsh classification
d)HLA DQ6 and HLA DQ11","HLA-DQ2 and DQ8 are associated with celiac disease, not HLA DQ6 and HLA DQ11.
celiac disease or celiac sprue or gluten-sensitive enteropathy is triggered by the ingestion of
gluten-containing foods such as barley, rye, oats, and wheat (mnemonic: BROW) in genetically predisposed individuals. It usually affects the 2nd part of the duodenum or proximal jejunum.
Diagnosis:



• Tissue Transglutaminase Ab (tTG-IgA) - single best screening test (option A)
• IgG Anti-gliadin antibodies (option B) are produced in response to gliadin, a component found  in wheat. These are associated with celiac disease along with other antibodies like IgA Anti-tissue transglutaminase antibodies and Anti-endomysial antibodies.
• HLA-DQ2 or DQ8- HLA testing is useful for ruling out celiac disease.
• Endoscopy with small bowel biopsy is used as a confirmatory test to diagnose celiac disease and not as an initial test in suspected cases.
• The histopathology is characterized by villous atrophy, crypt hyperplasia, and increased
intraepithelial CD8+T lymphocytes. An increase in the number of intraepithelial lymphocytes is a sensitive marker of celiac disease, even in the absence of epithelial damage and villous atrophy.
• Modified MARsH's score (option C) is used to assess celiac disease histologically.",,D,4561-2852.PNG
Q23,All of the following help to prevent the spread of COvID-19 except,"a)Cough etiquette
b)Mask
c)Ivermectin
d)vaccine","Ivermectin does not help prevent the spread of CoVID-19.
Basic protective measures to prevent the spread of CoVID-19:
• wash your hands frequently for at least 2o seconds.
• Maintain social distancing- Maintain at least 1 metre distance between yourself and anyone who is coughing or sneezing wearing a face mask (option B)
• Avoid touching eyes, nose and mouth
• practice respiratory hygiene (cough etiquette) - cover your mouth and nose with your bent elbow or tissue when you cough or sneeze, then dispose of the used tissue immediately. (option A)
• If you have a fever, cough, and difficulty breathing, seek medical care early
• stay informed and follow the advice given by your healthcare provider



• vaccination (option D)
covID-19 vaccines approved and in development:

vaccines	Mechanism
Pfizer/BioNtech	mRNA based vaccine
Moderna	mRNA based vaccine
oxford university/ Astra zen eca/ serum Institute of India (covishield)	Non-replicating viral vector
Gamaleya (sputnik v)/ Dr.Re ddys	Non-replicating viral vector
Johnson and Johnson	Non-replicating viral vector
Bharat biotech/NIv (covaxin)	Inactivated vaccine
zydus cadila (zycov-D)	Plasmid DNA vaccine
Novavax	Protein subunit",,C,
Q24,which among the following viruses is primarily water-borne?,"a)viral hepatitis A
b)viral hepatitis B
c)viral hepatitis C
d)viral hepatitis D","viral hepatitis A is primarily water-borne.
Hepatitis A and E are transmitted by fecal-oral route (waterborne). overcrowding, poor hygiene, and faecal contamination of water supplies, such as after monsoon flooding, can lead to the
spreading of the disease.
Hepatitis B, c, and D are transmitted by parenteral routes, e.g. blood transfusions.",,A,
Q25,"A patient presented with a blood pressure of 22o/12o mmHg in an altered sensorium. He also had an episode of vomiting and a history of weakness on the left side of his body. which of
the following is incorrect regarding hypertensive management in this case?","a)In hemorrhagic stroke, reduce the BP to less than 16o/1oo mmHg with antihypertensives to prevent rebleed
b)In hemorrhagic stroke, aggressive use of Iv antihypertensive if SBP &gt; 22o
c)In ER multiple blood pressure readings should be taken before starting anti-hypertensive therapy
d)In ischemic stroke, BP should be reduced to &lt;14o/9o mmHg immediately","option D is incorrect regarding hypertensive management in this case.  In ischemic stroke, BP should be reduced to &lt;185/11o mmHg immediately before doing thrombolysis.
In ischemic stroke, blood pressure is generally not aggressively lowered immediately unless it is     extremely high (usually &gt;22o/12o mmHg), because maintaining higher blood pressure can help ensure adequate perfusion of the brain tissue and reduce the risk of worsening ischemia. Before     performing thrombolysis in ischemic stroke, BP must be reduced to &lt;185/11omm Hg
immediately, and not less than &lt;14o/9o mmHg.  If the BP is reduced to &lt;14o/9o mmHg, it would further compromise the cerebral perfusion and can increase the infarct size. The goal is   typically to avoid lowering BP too quickly, and a more gradual reduction is preferred.
other options
option A: In hemorrhagic stroke, BP should be reduced to less than 16o/1oo mmHg with antihypertensives to prevent rebleed.



option B: In the case of hemorrhagic stroke, if the systolic blood pressure (SBP) is greater than   22o mmHg, aggressive lowering of blood pressure with IV antihypertensives is recommended to reduce the risk of further bleeding.
option C: In the emergency room, multiple blood pressure readings should be taken to accurately assess the patient's blood pressure before initiating any antihypertensive therapy, especially in a    setting like hypertensive emergencies.",,D,
Q26,which of the following is not a feature of thrombotic thrombocytopenic purpura?,"a)Thrombocytopenia
b)Thrombosis
c)Microangiopathic hemolytic anemia
d)Renal failure","Renal failure is not a feature of thrombotic thrombocytopenic purpura
Renal injury can occur in TTP due to microvascular injury, but it is not a defining feature of TTP, whereas the other three features (thrombocytopenia, thrombosis, microangiopathic hemolytic
anaemia) are key components of the disease.
Thrombotic thrombocytopenic purpura (TTP) is a rare hematological disorder primarily characterized by thrombocytopenia, microangiopathic hemolytic anaemia, neurological
symptoms, and sometimes fever. It is typically associated with the following:
• Thrombocytopenia
• Thrombosis
• Microangiopathic hemolytic anaemia
other options
option A: Thrombocytopenia is a hallmark feature ofTTP. Platelets are consumed in the formation of microthrombi, leading to a low platelet count.
option B: Thrombosis: TTP involves the formation of microthrombi (not large thrombosis) in
small vessels, particularly in organs like the kidneys, brain, and heart. These microthrombi lead to other characteristic features, including hemolysis and thrombocytopenia.
option C: Microangiopathic hemolytic anemia is another key feature ofTTP. The microthrombi
damage red blood cells as they pass through small blood vessels, resulting in hemolysis (destruction of red blood cells).",,D,
Q27,which of the following cannot help in differentiating psoriatic arthritis from other forms of arthritis?,"a)Dactylitis
b)presence of diarrhea
c)Enthesitis
d)Nail pitting","The presence of diarrhea is not a characteristic symptom of psoriatic arthritis, therefore, it cannot help in differentiating the condition from other forms of arthritis.
Psoriatic arthritis can sometimes be associated with inflammatory bowel disease causing diarrhea. However, diarrhea is not specific to psoriatic arthritis and can occur in other types of arthritis
such as reactive arthritis and certain types of infectious arthritis.
Psoriatic arthritis is an inflammatory type of arthritis mainly affecting the distal interphalangeal joints. In most cases, psoriasis precedes arthritis. other features include nail changes (pitting,
horizontal ridging, onycholysis, yellowish discoloration, hyperkeratosis), dactylitis, enthesitis, and



tenosynovitis. The Classification of Psoriatic Arthritis (CAsPAR) criteria are a useful tool for early diagnosis of psoriatic arthritis.
other options:
option A: Dactylitis is a characteristic feature of psoriatic arthritis, referring to the inflammation of an entire finger or toe. It is not commonly seen in other types of arthritis.
option C: Enthesitis (inflammation of the entheses) is a hallmark of psoriatic arthritis and is less common in other forms of arthritis like rheumatoid arthritis.
option D: Nail pitting (small depressions on the surface of the nails) is a feature strongly associated with psoriatic arthritis and is rarely seen in other forms of arthritis.",,B,
Q28,what is the mutation seen in sickle cell anemia?,"a)Glu---&gt; val(6)
b)Lys---&gt; Arg
c)Glu--&gt; lysine
d)Ala--&gt; Gly (9)","Glu---&gt; val(6) mutation is seen in sickle cell anemia.
sickle cell anemia is an autosomal recessive disorder that occurs due to a missense mutation (a type of point mutation) in the β-globin gene of Hbs, which results in the replacement of polar   glutamate residue with non-polar valine at the 6th position, generating a hydrophobic “sticky     patch” on the surface of the β subunit of deoxygenated Hbs.


Both HbA and Hbs contain a complementary sticky patch on their surfaces that is exposed only in the deoxygenated state. Thus, at low Po2, deoxyHbs polymerizes to form long, twisted helical
fibers. This distorts the biconcave RBC into a sickle shape. The precipitated Hbs also damages the RBC membrane, so the cells become highly fragile and get easily hemolyzed leading to anemia.





The major pathophysiology involves chronic hemolysis and microvascular occlusion. Hypoxia
increases the concentration of deoxygenated HbS promoting RBC sickling. These sickle cells can disrupt circulation causing vascular occlusion and tissue infarction. vaso-occlusive crises, also
known as pain crises, are a result of this hypoxic injury and infarction. These crises predominantly affect the bones, lungs, liver, brain, spleen, and penis.",,A,4564-2853.PNG;4565-2854.PNG
Q29,"A female patient with type 1 DM and hypothyroidism presented with chronic oral mucocutaneous candidiasis for 5 years. she is diagnosed with autoimmune
polyendocrinopathy syndrome type 1. which of the following is incorrect about this condition?","a)DM type-1 association is high
b)starts in infancy
c)Hypoparathyroidism
d)High association with candidiasis","Diabetes mellitus type 1 usually occurs in APS-2 and is less commonly associated with APS-1.
This clinical scenario is suggestive of autoimmune polyendocrinopathy (APS) type 1. It is also called APECED (autoimmune polyendocrinopathy, candidiasis, and ectodermal dystrophy).
It is caused by mutations in the autoimmune regulator (AIRE) gene. This gene usually increases     the tolerance of central T-cells to peripheral tissue antigens. when this function is lost, the T-cells become more prone to mount immune reactions against tissue antigens, promoting
autoimmunity. These patients develop autoantibodies against IL-17 and IL-22, which are crucial    for defence against fungal infections. APS type 1 usually presents in childhood. It can also start in infancy (option B) and the presentation can evolve over time.
APS type 1 presents in childhood with the following features:
• Chronic mucocutaneous candidiasis (option D)
• Ectodermal dystrophy (abnormalities of the skin, dental enamel, and nails)
• organ-specific autoimmune disorders such as -
• Autoimmune adrenalitis
• Autoimmune hypoparathyroidism (option C)
• Idiopathic hypogonadism
• Pernicious anemia



Autoimmune polyendocrine syndrome (Aps) type 2 usually presents in early adulthood as a combination of the following:
• Adrenal insufficiency
• Autoimmune thyroiditis or type 1 diabetes",,A,
Q30,All of the following are examples of HAGMA except?,"a)DKA
b)Diarrhoea
c)AKI
d)Inborn error of metabolism","Diarrhoea is an example of NAGMA (Normal anion gap metabolic acidosis), not HAGMA (High anion gap metabolic acidosis).
other three options, i.e., DKA, AKI and inborn error of metabolism are examples of HAGMA.",,B,
Q31,LMN lesions are associated with?,"a)1,2
b)1,2,3
c)1,2,3,4
d)1,4","Lower Motor Neuron lesions result in flaccid paralysis, characterized by decreased muscle tone (hypotonia) and fasciculations.
The hallmark signs of Lower Motor Neuron lesions include:
• Flaccid paralysis: Decreased muscle tone (hypotonia) and reflexes (hyporeflexia).
• Muscle atrophy: Due to denervation.
• Fasciculations: Due to spontaneous activity in motor neurons.
• Absent Babinski reflex.

sign	upper Motor Neu ron	Lower Motor Ne uron
Atrophy	None	severe
Fasciculations	None	common
Tone	spastic	Decreased
Distribution of weaknes s	pyramidal/ region al	Distal/ segmental
Muscle stretch reflexes	Hyperactive	Hypoactive/ abse nt
Babinski sign	present	Absent",,D,
