number,question,options,solution,image_q,answer_key,image_a
18,which of the following anti-diabetic drugs is associated with the increased risk of fractures?,"a) Rosiglitazone
b) Liraglutide
c) voglibose
d) canagliflozin","canagliflozin is associated with an increased risk of fractures.
canagliflozin is a sodium-glucose transporter-2 (SGLT2) inhibitor. SGLT2 is a Na+-glucose cotransporter that is located in the proximal convoluted tubule. They reabsorb glucose and sodium from the tubular lumen back into the blood through the epithelial cells. SGLT2 inhibitors block the transport of glucose in the proximal tubule and promote glycosuria and hence, lowering blood glucose.
The currently available SGLT2 inhibitors are canagliflozin, dapagliflozin, and empagliflozin. other than decreasing blood glucose they also decrease blood pressure and, cause weight loss of 2–4 kg. Empagliflozin and canagliflozin reduce the risk for major cardiovascular events.
The main side effect of SGLT2 inhibitors is an increase in lower urinary tract infections and genital mycotic infections. This is because of their glycosuric properties. A recent warning from the FDA says that SGLT2 inhibitors may increase the risk of fractures. They also affect circulating levels of parathyroid hormone, and 1,25-hydroxy vitamin D thereby affecting the mineral balance in bone.
other options:
option A: Rosiglitazone is a thiazolidinedione that acts as a peroxisome proliferator-activated receptor ? agonist in the adipose tissue which increases insulin sensitivity and adipose differentiation. Side effects are weight gain, edema, and increased risk of fractures. compared to rosiglitazone, canagliflozin is commonly used in clinical practice. American diabetes association recommends canagliflozin as the first-line drug along with metformin, in patients with a high risk of cardiovascular disease, renal failure, and heart failure. Even when thiazolidinediones are required, clinicians prefer pioglitazone over rosiglitazone due to the higher risk of cardiovascular-related mortality in rosiglitazone. Therefore, canagliflozin would be a better option compared to rosiglitazone.
option B: Liraglutide is a long-acting glucagon-like peptide-1 agonist. Nausea, diarrhea, and acute pancreatitis are some frequent side effects.
option c: voglibose reduces the intestinal absorption of starch, dextrin, and disaccharides by inhibiting the action of a-glucosidase in the intestinal brush border. The most prominent adverse effects are malabsorption, flatulence, diarrhea, and abdominal bloating.",,D,
19,The active metabolite of cyclophosphamide is:,"a) N - hydroxy cyclophosphamide
b) 4 - hydroxy cyclophosphamide
c) 4 - acetyl cyclophosphamide
d) N - acetyl cyclophosphamide","The active metabolite of cyclophosphamide is 4 - hydroxy cyclophosphamide.
cyclophosphamide is an alkylating agent with antitumor and immunosuppressant properties. It is used for many solid tumors. The important side effects are cystitis due to metabolite acrolein and bladder carcinoma.
cystitis caused by cyclophosphamide is treated by systemic administration of mesna and by irrigating the bladder with acetylcysteine. Both these drugs contain –SH which detoxifies the toxic metabolites. plenty of fluids and frequent bladder voiding are also helpful.",,B,
20,urinary alkalinization will be most useful in toxicity of which of the following drugs?,"a) Beta blockers
b) calcium channel blockers
c) Acetaminophen
d) Aspirin","Alkalinization of urine will be helpful in the removal of aspirin, which is a weakly acidic drug and is susceptible to ion trapping in the urine.
Aspirin is a weak acid, with a pka of 3.o. Drugs that are subjected to renal clearance are excreted into the urine by glomerular filtration and active tubular secretion. Nonionized compounds are reabsorbed more rapidly than ionized polar molecules. when the pH of the urine increases, more salicylate is in its ionized form at equilibrium. Hence, salicylic acid diffuses into the tubular lumen of the kidney. urine alkalinization is recommended as a first-line treatment only for moderately severe salicylate poisoning that does not meet the criteria for hemodialysis.
Alkalinization of the urine is achieved by administration of 1oo–15o mEq of sodium bicarbonate in 1 L of 5% dextrose in water (D5w). It is infused intravenously at twice the maintenance fluid requirements.
Alkalinization of urine is contraindicated in renal failure or if fluid administration may worsen pulmonary edema or congestive heart failure.",,D,
21,A hospital is conducting a study to check the efficacy of statins in multiple centers. There are 4-5 patients per center and half of the patients receive the drug and the other half receive the placebo. Neither the patients nor clinicians know which drug is being administered. what phase of the clinical trial describes the above scenario?,"a) phase 1
b) phase 3
c) phase 2
d) phase 4","A hospital conducting a double-blinded study in multiple centers to check the efficacy of statins describes phase 3 of the clinical trial. A phase 2 clinical trial is generally conducted at a few centers (2-4) by physicians.
phase 3 of a clinical trial is also known as a multisite trial. It is conducted on a large patient population (5oo–3ooo) by several physicians at multiple centers. This phase involves patients who have been diagnosed with the disease that the drug claims to treat. Its purpose is to confirm the efficacy of the newly developed drug in a larger population. phase 3 is randomized, controlled, and may be blinded.",,B,
22,A patient who is a known addict is brought to the hospital with the intoxication of an agent. An ocular examination shows the following finding. which of the following is true regarding this condition?,"a) This action can be reversed by phenylephrine.
b) It cannot be reversed by levallorphan.
c) It is caused by activation of the Edinger-westphal nucleus.
d) Tolerance develops due to long-term use.","The given clinical scenario and the image showing a pin-point pupil (miosis) suggest opioid overdose. The true statement among those given is that it is caused by activation of the Edinger-westphal nucleus.
Edinger-westphal nucleus is a part of the light reflex pathway and is located in the midbrain. This nucleus is responsible for causing pupillary constriction when the retina is exposed to light.
opioid overdose symptoms are a triad of coma, respiratory depression, and pinpoint pupils (miosis). other features are hypotension, bradycardia, shallow breathing, and hypothermia. Tolerance to miosis does not develop even in addicts who develop a high tolerance to opioids. Miosis is induced by all opioid agonists.
Naloxone is the drug of choice for opioid overdose. It is administered after adequate ventilation is established. Airway protection and ventilatory maintenance are the most important steps in the treatment of opioid overdose; this is because respiratory depression is the major cause of mortality in such cases. single-dose activated charcoal can be administered if the opioid ingestion occurred within one hour.
Levallorphan is an opioid antagonist, with properties similar to those of naloxone. It can be used for opioid overdose. It reverses severe opioid-induced respiratory depression.
phenylephrine is an a1-selective agonist that causes mydriasis, but it is not useful in the reversal of opioid-induced miosis.",1168-763.PNG,C,
23,Match the following drugs in Column A with their contraindications in Column B.,"a) A-1, B-3, C-2, D-4
b) A-4, B-1, C-3, D-2
c) A-2, B-4, C-1, D-3
d) A-3, B-2, C-4, D-1","The correct answer is option B: A-4, B-1, C-3, D-2
In a patient with head injury, morphine is contraindicated because it increases intracranial tension due to Co¦ retention, precipitates respiratory depression, and may cause vomiting, miosis, and altered mental state which interferes with assessment of mental state.
Amiodarone should not be used in patients with prolonged QT interval because it may cause marked prolongation of the QT interval, bradycardia, and torsades de pointes.
Vigabatrin, an inhibitor of GABA-transaminase, an anti-convulsant, is contraindicated in pregnancy due to its potential teratogenic effect.
Estrogen preparations can contribute to the incidence and severity of thromboembolism, particularly if other risk factors are present. The risk of serious cardiovascular side effects is particularly marked in women more than 35 years of age who smoke heavily.
A. Morphine
4. Head Injury
B. Amiodarone
1. QT prolongatio n
C. Vigabatrin
3. pregnancy
D. Estrogen preparation s
2. Thromboembo lism",,B,
24,which of the following statements is true regarding memantine?,"a) 1, 2, 3, 4
b) 1, 2
c) 3, 4
d) 1, 2, 3","1 and 2 are true statements regarding memantine.
Memantine is a non-competitive NMDA receptor antagonist. It inhibits glutamate excitotoxicity. It delays the progression of dementia in Alzheimer's disease. Commonly, it is started in patients with moderate-to-severe disease.
It can be given both as monotherapy or can be given along with cholinesterase inhibitors. It can be started at a dose of 5 mg once daily and then progressively increased up to 1o mg twice daily for a minimum of 6 months.
It can cause dizziness and headache. Since it is excreted in the kidney, careful dose adjustments should be made in patients with renal failure.",,B,
25,The image below shows the life cycle of a virus. which of the following drugs acts at step 5?,"a) Raltegravir
b) Enfuvirtide
c) Tenofovir
d) zidovudine","Step 5 in the given life cycle shows the integration of the viral DNA into the host genome.
Raltegravir is an integrase inhibitor and is active against both HIV-1 and HIV-2. It can be used in adults and children >1 month old.
It is advised for patients to consume antacids and sucralfate, 6 hours before or 2 hours after raltegravir intake.
It may cause headaches, nausea, weakness and fatigue. Rarely, it can lead to drug reactions with eosinophilia and systemic symptoms (DRESS) syndrome.
The steps involved in the lifecycle of HIV as given in the image are described as follows:
• step 1: Binding of HIV-1 to the cell membrane of a CD4+ cell
• step 2: HIV-1 enters the cell via interaction with the membrane glycoproteins
• step 3: Reverse transcription of the viral genetic material using the virus' reverse transcriptase enzyme
• step 4: The HIV-1 genome travels into the nucleus
• step 5: The viral genome integrates into the host's DNA through the integrase enzyme
• step 6: The HIV-1 proviral genome undergoes transcription with the host DNA
• step 7: The viral messenger RNA (mRNA) undergoes translation to produce new viral proteins
• steps 8 and 9: Assembly and maturation of the virion
other options:
option B: Enfuvirtide acts at step 2 in the given image. It blocks gp41 of the cell membrane and blocks the entry of the virus into the cell. It prevents the free viral particles from invading new CD4+ cells. It is effective against HIV-1.
option C: Tenofovir acts at step 3 in the given image. It is a nucleotide reverse transcriptase inhibitor (NRTI) that is effective against HIV-1,2 and hepatitis B infections. It is used in adults and children >2 years old. It can also be used for pre-exposure prophylaxis.
option D: zidovudine also acts at step 3 in the given image. It is an NRTI and is effective against HIV-1,2 and Human T-cell Lymphoma Virus (HTLV). It can be used in adults and children. It can also be used to prevent mother-to-child transmission.",,A,1197-777.PNG
26,which of the following statements is correct regarding clinical trials?,"a) New drug application is done after phase 4
b) phase 4 is also called post-marketing surveillance
c) phase 3 is always double-blinded
d) phase 2 is done on healthy individuals","phase 4 clinical trials are also called post-marketing surveillance is the correct statement.
other options:
option A: New drug application is done after phase 3 of clinical trials.
option C: phase 3 trials may or may not be blinded.
option D: phase 2 trials are the first round of trials in patients. phase 1 trials are done in healthy volunteers.",,B,
27,Match the following teratogenic drugs with their teratogenic effects.,"a) 1-a, 2-b, 3-c, 4-d
b) 1-c, 2-d, 3-a, 4-b
c) 1-d, 2-a, 3-d, 4-c
d) 1-d, 2-c, 3-b, 4-a","The correctly matched pairs of teratogenic drugs and their effects is 1-d, 2-c, 3-b, 4-a.
Lithium use in early pregnancy causes Ebstein anomaly in the fetus. Fetal lithium exposure is associated with neonatal goiter, CNS depression, hypotonia (floppy baby syndrome), and cardiac murmur.
Gray baby syndrome occurs in neonates, especially premature ones, exposed to high doses of chloramphenicol (1oo mg/kg), which are administered prophylactically.
Fetal warfarin syndrome or warfarin embryopathy presents with CNS abnormalities, depressed nasal bridge/ saddle nose at birth, bleeding diathesis, and growth retardation. Hypoplasia of the nose, eye sockets, and long bones with stippling of epiphyses are also seen.
Fetal thalidomide exposure causes phocomelia. This disorder is associated with underdeveloped limbs and absent pelvic bones. Both upper and lower limbs are affected, and a part of the limbs may be missing. Fused fingers and missing thumbs are also seen. Thalidomide was originally used for the treatment of pregnancy-associated morning sickness but was withdrawn due to this adverse effect. It re-entered the market for the treatment of erythema nodosum leprosum. It also has antiangiogenic and immunomodulatory effects.",,D,
28,"A young man sustained a scorpion sting 2 hours ago. on examination, his blood pressure is 108/ 60 mm Hg; HR, 72 beats/minute, and respiratory rate, 32 breaths/minute. He also complains of breathlessness. How do you manage this patient?","a) Metoprolol
b) Ivabradine
c) prazosin
d) Frusemide","The drug used to manage this condition is prazosin as it can counteract the effects of breathlessness most probably caused by pulmonary edema.
The venom is a potent autonomic stimulator that causes the release of massive amounts of catecholamines from the adrenals. It also has a direct effect on the myocardium.
It can present as neurotoxicity with restlessness or seizure-like activity, abnormal oculomotor function, and loss of pharyngeal muscle control that leads to respiratory compromise. Tongue fasciculations and hypersalivation are also common. Cardiovascular toxicity from systemic envenomation includes tachycardia, hypertension, pulmonary edema, and cardiogenic shock.
If the scorpion has hemolytic venom, the reaction is mainly local, with edema, pain, and reddening. This usually lasts for one to two hours.
Treatment:
• pain - paracetamol, NSAIDs, or opioids
• sedation for agitation, oculomotor abnormalities, uncoordinated neuromuscular activity, and muscle spasms - Benzodiazepines
• Hypertension and pulmonary edema - Prazosin counteracts the adrenergic surge that can lead to these effects
• cardiogenic shock - Antivenom, prazosin, nitroglycerin, dobutamine
• cholinergic effects - Atropine
• supportive care, wound care",,C,
29,An experiment is being conducted on a cat spine to study the effect of acetylcholine. The blood pressure is recorded at each intervention and is shown below. what does phase 4 in the graph indicate?,"a) Muscarinic action of acetylcholine
b) potentiation of acetylcholine
c) Antagonism of acetylcholine
d) Nicotinic action of acetylcholine","Phase 4 in the graph indicates the nicotinic action of acetylcholine at higher doses.
In phases 1 and 2, acetylcholine (Ach) acts on muscarinic receptors (at 2 micrograms and 5o micrograms) bringing down blood pressure. Atropine blocks the muscarinic receptor, so this action of acetylcholine is not seen in phase 3. However, in phase 4, higher doses ofAch (like 5 mg) act via the nicotinic receptor, shooting up the blood pressure. This phenomenon is called the reversal of Ach in blood pressure and was studied by Dale.
Nicotinic receptors are ligand-gated ion channels. It can be divided into two groups: muscle receptors (NM), which are found at the skeletal neuromuscular junction, and neuronal receptors (NN), which are found in the ganglia and cNs. when stimulated at higher doses, Ach acts on NN receptors, leading to the stimulation of sympathetic ganglia and adrenal medulla.
This increases the heart rate, blood pressure, and myocardial contractility.
Muscarinic receptors are G-coupled protein receptors involved in the parasympathetic nervous system. M1, M2, M3, M4, and M5 are the receptor subtypes. They act via Gi or Gq subunits. when Ach is administered, it acts on muscarinic receptors, primarily the M3 receptors, which are located on vascular endothelial cells. It stimulates guanylyl cyclase and promotes relaxation via a cyclic GMP–dependent mechanism. At higher doses, it acts on M2 receptors, which have direct effects on the heart. It also inhibits the release of norepinephrine from sympathetic nerve terminals and decreases cyclic AMP levels.",1170-765.PNG,D,
30,"A patient who is a known case of HIV is started on combined active antiretroviral therapy (cART). After 5 months of treatment, he develops hyperpigmentation in the palms and soles. what is the most likely drug causing this?","a) Nelfinavir
b) Emtricitabine
c) Abacavir
d) zidovudine","The most likely drug causing hyperpigmentation of the hands and soles would be emtricitabine.
Emtricitabine is an anti-retroviral drug that acts by inhibiting nucleoside reverse transcriptase (NRTI). It is well-tolerated and has minimal toxic effects. Adverse effects include hyperpigmentation of the skin (especially sun-exposed areas, palms, and soles), headache, vomiting, and nausea.
other options:
option A: Nelfinavir is a protease inhibitor that causes diarrhea or loose stools. It usually resolves within a month of starting the drug.
option C: Abacavir is an NRTI that can cause a life-threatening hypersensitivity syndrome. The syndrome presents with fever, abdominal pain, and maculopapular rash within 6 weeks of initiating abacavir. The drug must be immediately discontinued and must not be administered to the patient thereafter. Rarely, there might be respiratory and musculoskeletal side effects.
option D: zidovudine is an NRTI that causes malaise, fatigue, myalgia, anorexia, and insomnia. Chronic use leads to nail hyperpigmentation. It can also cause bone marrow suppression.",,B,
31,Dorzolamide is a ______.,"a) Topically applied sulfonamide antibacterial
b) Topical ocular carbonic anhydrase inhibitor
c) second-generation sulfonylurea
d) opioid receptor agonist","Dorzolamide is a topical ocular carbonic anhydrase inhibitor.
It acts on carbonic anhydrase in the ciliary processes of the eye and mediates the formation of HCo3- in aqueous humor. Inhibition of carbonic anhydrase decreases the rate of formation of aqueous humor and consequently reduces intraocular pressure.
The major indication for carbonic anhydrase inhibitors is open-angle glaucoma. Dorzolamide and brinzolamide, which are available only as ophthalmic drops, are used for this purpose.
Dorzolamide may be used for secondary glaucoma and in acute angle-closure glaucoma to lower intraocular pressure before surgery.",,B,
32,A patient with erectile dysfunction is given sildenafil. The penile erectile function is found to be improved after the therapy. which of the following mediates the action of sildenafil?,"a) cAMP
b) cGMP
c) Calcium
d) Phosphatidyl glycerol and inositol phosphate","sildenafil is a phosphodiesterase 5 inhibitor and the action of the drug is mediated through cGMP. Erectile dysfunction is treated by phosphodiesterase-5 (PDE-5) inhibitors like sildenafil, vardenafil, and tadalafil.
The corpus cavernosum produces nitric oxide during arousal that stimulates the formation of cGMP. cGMP causes relaxation of the smooth muscle of the corpus cavernosum and penile arteries, engorgement of the corpus cavernosum, and erection.
The above-mentioned drugs compete for cyclic GMP, binding at the site of cyclic GMP hydrolysis on PDE5, enhancing the accumulation of cGMP and hence used in the management of erectile dysfunction. They are useful in treating pulmonary arterial hypertension.
Adverse effects of the drug are headache, flushing, nasal congestion, nasopharyngitis, and dyspepsia. sildenafil and vardenafil also cause retinal PDE-6 inhibition and can result in blurring of vision and blue-green tinting of the vision.",,B,
33,Match the following diuretics in column A to their site of action in column B.,"a) A-2, B-3, C-1, D-4
b) A-3, B-4, C-2, D-1
c) A-1, B-2, C-4, D-3
d) A-4, B-1, C-3, D-2","The correct match is as follows:
Acetazolamide, a carbonic anhydrase inhibitor, acts on the enzyme in epithelial cells of the proximal convoluted tubule. Acetazolamide is mainly used in patients with secondary glaucoma to reduce intra-ocular pressure, provide symptomatic relief in acute mountain sickness, and as treatment for absence seizures.
Torsemide, a loop diuretic, inhibits the Na+-K+-ATpase symporter in the thick ascending loop of Henle. It is used in acute pulmonary edema, edema associated with congestive cardiac failure, hypertension with renal insufficiency, and hyponatremia.
chlorthalidone, a thiazide-like diuretic, inhibits the Na+-cl- symporter in the distal convoluted tubule. It is used in hypertension and in edema associated with congestive cardiac failure, hepatic cirrhosis, nephrotic syndrome, and chronic renal failure.
vasopressin, also known as anti-diuretic hormone, is secreted by the posterior pituitary and mainly acts on the collecting duct, and increases the reabsorption of water (anti-diuresis).
vasopressin or its agonists (such as desmopressin) are used in cases of diabetes insipidus, type I and type II von willebrand's disease, primary nocturnal enuresis, and postoperative ileus.
column A
column B
A. Acetazolamid e
4. proximal convoluted tubul e
B. Torsemide
1. Thick ascending loop of He nle
c. chlorthalido ne
3. Distal convoluted tubule
D. vasopressin
2. collecting duct",,D,
34,Alkalinization of urine will be helpful in the removal of______.,"a) weakly basic drugs
b) strong electrolytes
c) polar drugs
d) weakly acidic drugs","Alkalinization of urine will be helpful in the removal of weakly acidic drugs as they are susceptible to ion trapping in the urine.
Drugs that are subjected to renal clearance are excreted into the urine by glomerular filtration and active tubular secretion. Nonionized compounds are reabsorbed more rapidly than ionized polar molecules. when the pH of the urine increases, more salicylate is in its ionized form at equilibrium. Hence, salicylic acid diffuses into the tubular lumen of the kidney. urine alkalinization is recommended as a first-line treatment only for moderately severe salicylate poisoning that does not meet the criteria for hemodialysis.
Alkalinization of the urine is achieved by administration of 1oo–15o mEq of sodium bicarbonate in 1 L of 5% dextrose in water (D5w). It is infused intravenously at twice the maintenance fluid requirements.
Alkalinization of urine is contraindicated in renal failure or if fluid administration may worsen pulmonary edema or congestive heart failure.",,D,
35,"All of the following side effects are more commonly seen with carbamazepine than oxcarbazepine, except_____.","a) Hypotension
b) Hyponatremia
c) Rash
d) Elevated levels of gamma glutamyl transpeptidases","Hyponatremia occurs more frequently in the case of oxcarbazepine than carbamazepine.
Both carbamazepine and oxcarbazepine are sodium-channel blockers.
carbamazepine is most effective in complex partial seizures. It is also used in GTcs and simple partial seizures, trigeminal and related neuralgias, and manic depressive psychosis.
carbamazepine potentiates the action of antidiuretic hormone (ADH). It can result in water retention with decreased osmolarity and hyponatremia, especially in elderly patients with cardiac disease. carbamazepine and oxcarbazepine can cause leukopenia, aplastic anemia, hepato-toxicity and hyponatremia in the elderly.
oxcarbazepine shows lesser hypersensitivity reaction. Hence, rashes are more commonly seen with carbamazepine than with oxcarbazepine.
studies have shown that carbamazepine elevates enzyme gamma-glutamyl transpeptidases (GGT) more frequently than oxcarbazepine because of enzyme p45o induction.
Mechanism of action of some common antiepileptics:
Mechanism of action
Antiepileptics
sodium-channel blockers
phenytoincarbamazepine, o xcarbazepineEslicarbazepine LamotrigineTopiramateFelba matevalproateRufinamideLe vetiracetam
calcium-channel blockers
valproateLamotrigineEthosu ximide
GABAAreceptor modulators
Benzodiazepinesphenobarbit alFelbamateprimidoneTopira matecarbamazepine, oxcarb azepinestiripentolclobazam
GABA uptake inhibitors
Tiagabinevigabatrin
NMDA receptor antagonist
Felbamate
AMpA/kainate receptor anta gonist
phenobarbitalTopiramateper ampanel
HcN channel activity enhanc ers
Lamotrigine
Inhibitors of brain carbonic a nhydrase
AcetazolamidezonisamideTo piramate
potassium-channel openers
RetigabineTopiramate",,B,
