number,question,options,solution,image_q,answer_key,image_a
1,The extent of drug absorption is represented by:,"a) Tmax
b) Area under the curve
c) cmax
d) t1/2","The extent of drug absorption is represented by the area under the curve.
The rate and extent of absorption of a drug from dosage form administered by any route refer to the bioavailability of a drug. Bioavailability is determined by the concentration-time curve in blood or by its excretion in urine. The area under the blood concentration-time curve (AUC) is proportional to the dose and the extent of bioavailability of a drug.
Bioavailability is defined as the fraction of unchanged drug that reaches systemic circulation. It can be represented by the formula:
Bioavailability(F) = Quantity of drug reaching systemic circulation/ Quantity of drug administered. Bioavailability depends on two factors:
• Absorption
• 1st pass metabolism
The area under the plot of plasma concentration of a drug versus time after dosage is called the area under the curve or AUC. It can be used as a measure of the bioavailability of a drug and to calculate its clearance rate from the body.
The image given below shows the AUC (bioavailability) in a plasma concentration-time curve:
Bioavailability of drug injected intravenously is 1oo%, but it is lower after oral ingestion because of incomplete absorption and first-pass metabolism in the intestinal wall/liver.
The image below shows the difference between the bioavailability of drugs injected intravenously(iv) and orally(po). Note the area under the respective curves is shaded in red and blue colours which represent the absorption of the drug.",,B,1182-771.PNG;1182-770.PNG
2,which of the following statement is correct regarding the given graph?,"a) Drug 1 represents agonist and drug 2 represents inverse agonist
b) Drug 3 represents agonist and drug 4 represents inverse agonist
c) Drug 1 represents agonist and drug 4 represents inverse agonist
d) Drug 2 represents partial agonist and drug 3 represents inverse agonist","The correct statement is Drug 1 represents agonist and drug 4 represents inverse agonist.
Graph 1 represents the agonist: An agonist is an agent which initiates the normal physiological response when combined with a receptor.
Example: salbutamol is a beta-2 receptor agonist.
Graph 2 represents a partial agonist: An agent which produces a submaximal or partial effect when combined with a receptor.
Example: Buprenorphine and butorphanol are partial agonists at opioid receptors.
Graph 3 represents the antagonist: An agent which blocks or reduces the action of an agonist on a receptor, but does not have any effect of its own.
Example: Naltrexone and naloxone are antagonists at opioid receptors
Graph 4 represents an inverse agonist: An agent which activates a receptor to produce an effect in the opposite direction to that of the agonist.
Example: ß-carboline is an inverse agonist at benzodiazepine site of GABA-A receptor. The image given below shows action of various types of selective receptor modulators.",,C,1183-772.PNG
3,which among the following drugs is the new FDA approved immune check point inhibitor for carcinoma endometrium?,"a) Nivolumab
b) pembrolizumab
c) Trastuzumab
d) Ipilimumab","The new FDA-approved immune checkpoint inhibitor for carcinoma endometrium is pembrolizumab.
Pembrolizumab acts by inhibiting programmed death receptor - 1 (PD-1) and was used for the treatment of advanced melanoma. Now, the FDA has approved the use of pembrolizumab for any cancer with mismatch repair (MMR) deficiency or high microsatellite instability (MSI-H).
on March 21, 2022, the food and drug administration approved pembrolizumab, as a single agent, for patients with advanced endometrial carcinoma that is microsatellite instability-high (MSI-H) or mismatch repair deficient (dMMR), as determined by an FDA-approved test.
other options:
option A: Nivolumab is an immune checkpoint inhibitor that acts by inhibiting programmed death receptor - 1 (PD-1) and is used for the treatment of advanced melanoma and relapsed/refractory classical Hodgkin lymphoma.
option C: Trastuzumab is a monoclonal antibody that inhibits the HER2 receptor. It is used in the treatment of HER2-positive breast cancer.
option D: Ipilimumab is a monoclonal antibody that binds to cytotoxic T lymphocyte–associated Protein 4 (CTLA-4) and is approved for the treatment of late-stage melanoma.",,B,
4,which of the following is not an immune checkpoint inhibitor?,"a) Nivolumab
b) pembrolizumab
c) Atezolimumab
d) cetuximab","Cetuximab is not an immune checkpoint inhibitor. Cetuximab is a monoclonal antibody against epidermal growth factor receptor(EGFR). It is used for the treatment of colon cancer and head and neck squamous cell cancer.
other options.
option A: Nivolumab is an immune checkpoint inhibitor. It acts by inhibiting programmed death receptor - 1 (PD-1) and is used for the treatment of advanced melanoma and classical Hodgkin lymphoma.
option B: Pembrolizumab is an immune checkpoint inhibitor. It acts by inhibiting programmed death receptor - 1 (PD-1) and is used for the treatment of advanced melanoma. In 2021, approval was granted for the treatment of patients with endometrial carcinoma that progressed after systemic treatment, in combination with lenvatinib.
option C: Atezolimumab is an immune checkpoint inhibitor. It acts by inhibiting programmed death-ligand - 1 (PDL-1) and is used for the treatment of non-small cell lung cancer.
Important note:
The FDA on May 2021 approved the use of nivolumab in patients having completely resected esophageal or gastroesophageal junction cancers with residual pathologic disease who have received neoadjuvant chemoradiotherapy.",,D,
5,NApQI is the metabolite of which of the following drug toxicity?,"a) Aspirin
b) paracetamol
c) Diclofenac
d) ketorolac","N-acetyl-p-benzoquinone imine (NAPQI) is a metabolite of paracetamol drug toxicity.
Paracetamol is an analgesic and antipyretic with weak anti-inflammatory action. It is mainly metabolized in the liver by conjugation with glucuronic acid and sulfate and is excreted in the urine.
At toxic doses, the glucuronide and sulfate conjugation pathway becomes saturated. The metabolites of paracetamol get converted into NAPQI. NAPQI is highly reactive and causes enzymatic dysfunction in the liver. Normally, minor amounts of NAPQI produced in our body are rapidly eliminated by conjugation with reduced glutathione(GSH) and then excreted into the urine.
Therefore, paracetamol toxicity is treated with N-acetyl cysteine(NAC), which replenishes GSH. NAC thereby helps in the excretion of NAPQI from the body. N-acetyl cysteine is an anti-oxidant and functions by detoxifying NAPQI.
Paracetamol poisoning is the most common cause of liver failure necessitating transplantation.
The maximum dose of acetaminophen that can be given is 4 g/day.",,B,
6,"Identify the correct match, regarding the drug and its adverse effect.","a) Hydralazine - heart failure
b) Atenolol - hemolytic anemia
c) Aliskiren - hypokalemia
d) verapamil - constipation","The correct match is verapamil causes constipation.
verapamil is a calcium channel blocker used for the treatment of paroxysmal supraventricular tachycardia, atrial fibrillation, and atrial flutter. Bradycardia and constipation are the important side effects of verapamil.
other options:
option A: Hydralazine is a vasodilator used in the treatment of heart failure, and hypertensive emergencies, especially preeclampsia. The drug is used as a combination pill containing isosorbide dinitrate (BiDil) in the treatment of heart failure. The important side effect of hydralazine is drug-induced lupus.
option B: Atenolol is a cardioselective beta-1 blocker used in the treatment of angina and hypertension. Atenolol doesn't cause hemolytic anemia.
option C: Aliskiren is a direct renin inhibitor used as an alternative antihypertensive drug for those who do not respond or do not tolerate 1st line drugs. The side effect of aliskiren is hyperkalemia and not hypokalemia.",,D,
7,A lady who had undergone mastectomy for breast cancer is being treated with tamoxifen. How long should it be stopped for before she can conceive?,"a) 1 month
b) 3 months
c) No need to stop
d) Can be stopped and conceived soon after stopping","In a post-mastectomy patient undergoing therapy with tamoxifen, it should be stopped for 3 months before she can conceive.
Tamoxifen is a selective estrogen receptor modulator (SERM) and is used as a chemotherapeutic agent in receptor positive breast cancer patients to prevent recurrence after surgery. It is the drug of choice in pre-menopausal women. It has an agonistic action on the endometrium, leading to an increased risk of endometrial cancers (2 fold risk). Hence, it is not used in post-menopausal women.
It is contraindicated in pregnancy due to teratogenic effects such as craniofacial abnormalities and reproductive tract abnormalities. For the same reason, it has to be stopped for 3 months (due to long half-life) prior to conceiving. It is also stopped during lactation as it is secreted in breast milk. other complications of tamoxifen include deep vein thrombosis, pulmonary embolism, and hot flashes.
other breast cancer risk reduction techniques:
• Lifestyle modification: Low-calorie diet, daily exercise, no smoking, no drinking, etc.
• More frequent screening with mammogram +/- MRI
• Chemoprevention: Preferred in women >35 years of age in patients who are ER/PR positive.
Given for 5-1o years.
• SERMS (selective estrogen receptor modulators) - Tamoxifen and raloxifene. These have adverse effects.
• Aromatase Inhibitors (AIs): They are used only in post-menopausal women.
• Risk-reduction surgeries: preferred in patients with BRCA1/2 mutations or patients with first-degree relatives with breast cancers. provides >9o% risk-reduction. preferred in patients who have completed their family.
• Bilateral mastectomy
• Salpingo-oophorectomy: Best results when done < 4o years of age.",,B,
8,A young boy with a history of multiple blood transfusions presents with bone pain for the past 6 months. A peripheral smear showed sickle-shaped RBCs. which of the following drugs are not used in the treatment of his condition?,"a) Bebtelovimab
b) voxelotor
c) Hydroxyurea
d) L-glutamine","Bebtelovimab is not used in the treatment of sickle cell disease. The clinical features of multiple blood transfusions, bone pain, and sickle cells on peripheral smear are suggestive of sickle cell disease.
Bebtelovimab is the new monoclonal antibody used for the treatment of CoVID-19. It works by binding to the spike protein of the CoVID-19 virus. It has been found useful in reducing the risk of hospitalization or death. Bebtelovimab retains the activity against the omicron variant.
other options:
option B: Voxelotor is an inhibitor of hemoglobin S polymerase and stabilizer of sickle cell hemoglobin (HbS) that is used in the therapy of sickle cell disease.
option C: Hydroxyurea improves fetal haemoglobin (HbF) and is the primary drug for controlling HbS in sickle cell disease. Thus improving the oxygen-carrying capacity of the blood. Hydroxyurea also inhibits the enzyme ribonucleotide reductase (RNR), which is a rate-limiting step in the biosynthesis of DNA. This property of hydroxyurea is used in the treatment of various cancers, and myeloproliferative disorders like chronic myelogenous leukemia, and polycythemia.
option D: L-glutamine is a naturally occurring amino acid with antioxidant properties.
It increases the availability of reduced glutathione which may lessen oxidative damage in sickle red blood cells.",,A,
9,The half-life of letrozole is:,"a) 45 hours
b) 7o hours
c) 9o hours
d) 12o hours","The half-life of letrozole is 45 hours.
Letrozole is a reversible aromatase inhibitor. It is a non-steroidal compound that inhibits the aromatization of estrogen thereby causing estrogen depletion. Letrozole is rapidly absorbed with 99.9% oral bioavailability and has a t½ of around 41 hours.
Letrozole is used as the first-line drug for estrogen-positive breast cancer following mastectomy in post-menopausal women.
Adverse effects of letrozole are due to the depletion of estrogen. The commonly seen adverse effects are hot flashes, vaginal dryness, nausea, diarrhea, dyspepsia, accelerated bone loss, and thinning of hair.",,A,
10,Identify the false statement about eicosanoids.,"a) synthesized from arginine
b) synthesized from arachidonic acid
c) prostaglandins have 5 carbon ring
d) synthesized in platelets","A false statement about eicosanoids is they are synthesized from arginine. Eicosanoids are synthesized from arachidonic acid (option B)
Eicosanoids are the most universally distributed autocoids in the body. prostaglandins, thromboxanes, and leukotrienes comprise eicosanoids. Every cell is capable of synthesizing one or more eicosanoids. platelets primarily synthesize thromboxanes (option D).
Eicosanoids are synthesized from arachidonic acid. Arachidonic acid is derived from membrane phospholipids. The release of arachidonic acid (AA) from the membrane phospholipids is mainly mediated by phospholipase A.
AA is metabolized by cyclooxygenases to produce prostaglandins and lipoxygenases to produce leukotrienes and lipoxins.
Inhibitors of metabolism of arachidonic acid:
• corticosteroids cause inhibition of prostaglandin synthesis by inhibiting phospholipase A2.
• Non-steroidal anti-inflammatory (NSAIDs) drugs inhibit the synthesis of prostaglandins by inhibiting the enzyme cyclooxygenase.
• zileuton inhibits the enzyme lipoxygenase thereby decreasing the synthesis of leukotrienes.
chemically, all prostaglandins are considered to be derivatives of prostanoic acid, having a five-carbon ring (option c).
The image given below shows the synthesis of various eicosanoids from arachidonic acid:",,A,1187-773.PNG
11,The given diagram shows the steps in bacterial cell wall formation. Identify the site of action of beta-lactam antibiotics.,"a) 1
b) 2
c) 3
d) 4","Beta lactams act on step 4 in the given image.
Mechanism of action of beta-lactams: They are the cell wall synthesis inhibitor. The ß-lactam antibiotics inhibit this last step in peptidoglycan synthesis. They inhibit the enzyme transpeptidase which is required for cross-linking of the peptidoglycan chain.
Transpeptidases cleave the terminal D-alanine of the peptide chains and form cross-linkages between them. This cross-linking provides rigidity and stability to the cell wall.
Transpeptidases and other related proteins constitute penicillin-binding proteins(PBP) and, are located in the bacterial cell membrane. ß-lactam antibiotics are bactericidal. This is because bacterias swell and burst due to deficient cell walls when they divide in the presence of ß-lactam antibiotics. Penicillins, cephalosporins, monobactams, and carbapenems are examples of ß-lactam antibiotics.
Gram-positive bacteria are more susceptible to ß-lactam antibiotics than gram-negative because their cell wall is almost entirely made of peptidoglycan.
Resistance to ß-lactam antibiotics develops due to the production of the beta-lactamase enzyme and the development of altered penicillin-binding proteins like in methicillin-resistant Staphylococcus aureus (MRSA). ß-lactamases inactivate ß-lactam antibiotics by opening the ß-lactam ring. This could be overcome by using drugs that inhibit this enzyme. Examples of ß-lactamase inhibitors are clavulanic acid, sulbactam, and tazobactam.
other options:
option A: Fosfomycin inhibits step 1 in the image. It inhibits the cytoplasmic enzyme enol pyruvate transferase that catalyses the initial step in the bacterial cell wall and hence cell wall synthesis. It is used for the treatment of urinary tract infections.
option B: Bacitracin inhibits step 2 in the image. It is a cell wall synthesis inhibitor that interferes with dephosphorylation in the cycling of the lipid carrier which transfers peptidoglycan subunits to the growing cell wall. It is only given for topical application because of its severe nephrotoxicity when given systemically.
option C: vancomycin inhibits step 3 in the image. It binds to the D-Ala-D-Ala terminus of the newly formed peptidoglycan pentapeptide. This prevents further elongation of the peptidoglycan and its cross-linking. It is used against MRSA and Clostridium difficile infection. Redman syndrome due to histamine release following infusion is an important side effect.
Note: The FDA has approved the use of cefepime-enmetazobactam, a combination of a fourth-generation cephalosporin and beta-lactamase inhibitor for use in complicated UTIs (including pyelonephritis).",1164-761.PNG,D,
12,phospholipase C acts via which of the following G protein-coupled receptors?,"a) Gs
b) Gi
c) Gq
d) Go","Phospholipase C acts via the Gq type of G protein-coupled receptors.
G protein-coupled receptors (GPCRs) are cell membrane receptors that span across the membrane 7 times. They also serve as receptors for various peptide hormones, neurotransmitters, amino acids, etc.
Subtypes of GPCRs are distinguished by their alpha subunits. The important subtypes of GPCRs are Gs, Gp, Gq, and Go.
GPCRs act via various second messengers. The important ones with their action on the effector are:
• Gs causes activation of adenylyl cyclase and results in Ca2+ channel opening.
• Gi causes inhibition of adenylyl cyclase and results in k+ channel opening.
• Go causes Ca2+ channel inhibition.
• Gq causes activation of phospholipase C which generates the second messengers inositol 1,4,5-trisphosphate (IP3) and diacylglycerol (DAG). The water-soluble IP3 diffuses to the cytosol and mobilizes Ca2+ from endoplasmic reticular depots.
The given below image shows the effects of phospholipase C after activation by Gq",,C,1189-774.PNG
13,A patient was diagnosed with pulmonary tuberculosis and was started on first-line antitubercular drugs. which of the following drug acts by inhibiting the synthesis of the marked layer shown in the image?,"a) Isoniazid
b) Rifampicin
c) Pyrazinamide
d) Ethambutol","Isoniazid is the first-line antitubercular drug that acts by inhibiting the synthesis of mycolic acid.
Isoniazid is a first-line bactericidal drug that is used for the treatment of tuberculosis. This drug enters bacilli by passive diffusion. It then gets activated to its toxic form by the enzyme catalase-peroxidase(the enzyme encoded by the kat gene).
Normally, InhA and kasA are involved in the synthesis of mycolic acid. upon activation, the reactive metabolite of isoniazid forms complexes with NAD that inhibit InhA and kasA. Hence, isoniazid inhibits the production of mycolic acid.
The reactive isoniazid metabolite also forms complexes with NADP. This complex inhibits mycobacterial dihydrofolate reductase which results in the interruption of DNA synthesis.
side effects of isoniazid include:
• Peripheral neuritis due to interference with the production of active coenzyme pyridoxal phosphate from pyridoxine. Therefore, pyridoxine 1omg/day (vitamin B6) is given prophylactically along with isoniazid to prevent neurotoxicity.
• Hepatitis - isoniazid must be stopped at the first sign of hepatotoxicity.
• Rashes
• Anaemia
• Arthralgia
Toxicity of isoniazid results in metabolic acidosis, seizures, and coma.
other options:
option B: Rifampin acts by binding to DNA-dependent RNA polymerase to form a stable drug-enzyme complex. This complex suppresses RNA synthesis. side effects of rifampin are hepatitis, flu-like illness, orange-red colored urine, and body secretions.
option C: pyrazinamide is a prodrug, it is converted into an active metabolite pyrazinoic acid which makes the intracellular environment acidic and collapses the transmembrane proton motive force, thereby killing the bacteria. side effects include hyperuricemia and hepatotoxicity.
option D: Ethambutol inhibits arabinose transferase III, thereby decreasing arabinogalactan biosynthesis. This results in disruption in mycobacterial cell wall synthesis. optic neuritis is an important side effect of ethambutol. It results in decreased visual acuity and loss of red-green discrimination.",1165-762.PNG,A,
14,A man was brought to the emergency room after poisoning with an unknown substance. Muscarinic poisoning was suspected and he was treated for the same. what is the possible presenting feature which led to the diagnosis?,"a) Mydriasis
b) Diuresis
c) Muscle fasciculations
d) Bradycardia","Bradycardia is the possible presenting feature which led to the diagnosis of muscarinic poisoning.
Muscarinic poisoning occurs due to the consumption of poisonous mushroom-like Inocybe.
Muscarinic symptoms appear within an hour of eating the mushroom. These symptoms (along with nicotinic symptoms) can also be seen in organophosphate poisoning.
There are 5 subtypes of muscarinic receptors they are M1, M2, M3, M4, and M5. The effects exerted by the M receptors are given below:
• M1: Increased seizure activity.
• M2: Tremors, bronchoconstriction, bradycardia, abdominal cramping
• M3: Increased bladder contraction, miosis, increased salivary secretion
• M4: Cataplexy(sudden muscle weakness)
Atropine is used for the management of muscarinic poisoning. It competitively blocks the acetylcholine at the muscarinic receptors.",,D,
15,"A 29-year-old lady came to psychiatry OPD with symptoms of hypomania. There is a past history of maniac episode. Now, she is planning to conceive. which drug should be avoided for being highly teratogenic to the fetus?","a) valproate
b) Lithium
c) Oxcarbazepine
d) olanzapine","valproate should be avoided for being highly teratogenic to the fetus.
valproate is an anti-epileptic medication. It is also used as a mood stabilizer in manic episodes as well as in bipolar disorder. The repetitive firing caused by depolarization of cortical or spinal cord neurons is inhibited by valproate. It also prolongs the sodium channel inactivation.
The side effects of valproate (mnemonic: VALPRoATE)
• Vomiting
• Alopecia
• Liver toxicity
• Pancreatitis
• Rash
• obesity
• Anorexia
• Teratogenicity
• oedema
It causes congenital anomalies like neural tube defects (spina bififda), clefts, and cardiac anomalies. The intelligence quotient score of school-going children who were exposed in utero to valproate is found reduced. It also contributes to poor cognitive development in children. Folate supplementation reduces the chances of neural tube defects.
The images below show a baby and a USG with spinal bifida:
other options:
option B: Lithium is used for the treatment of bipolar disorder as well as mania. It was earlier implicated in causing Ebstein anomaly, however, recent studies suggest that lithium has a weak teratogenic effect.
option C: oxcarbazepine was earlier associated with teratogenicity and fetal malformations, however, recent studies suggest that oxcarbazepine monotherapy during pregnancy does not carry a significant risk of fetal malformations.
option D: olanzapine is an antipsychotic and an antimanic and it is not associated with teratogenicity.",,A,1191-775.PNG;1192-776.PNG
16,True statement regarding the administration of 5 alpha-reductase inhibitors is/are:,"a) 1, 2, 3
b) 1, 3, 4
c) 1, 4
d) 2, 3","True statements regarding the administration of 5 alpha-reductase inhibitors are 1,4. They reduce dihydrotestosterone levels and decrease prostate-specific antigen (PSA) levels.
5 alpha-reductase inhibitors are the competitive inhibitors of the enzyme 5 a-reductase which converts testosterone into the more active dihydroxy testosterone (DHT). This enzyme inhibition results in:
• Decreased DHT levels
• Decreased PSA levels
• Reduces prostate volume
However, plasma testosterone levels and LH (luteinizing hormone) levels remain unchanged
Finasteride and dutasteride are the 5 a-reductase drugs currently in use. They are used in benign prostatic hyperplasia (BPH) along with surgery and adrenergic a1 blockers for symptomatic relief. They can also be used in male pattern of baldness and hirsutism.
Side effects of 5 a-reductase drugs are:
• Impotence
• Decreased libido
• Gynecomastia
• Skin rashes",,C,
17,"The manufacturer of a drug company labels a drug as having 5oo mg paracetamol. on quantitative analysis of the drug, it actually contained only 2oo mg of paracetamol. what is this type of drug called?","a) spurious drug
b) Adulterated drug
c) unethical drug
d) Misbranded drug","This type of drug is called a misbranded drug. A drug stating that 5oomg of paracetamol is present in each tablet, but contains only 2oomg is a misbranded drug, according to the Drugs and cosmetics Act, 194o definition of misbranded drugs.
According to the Drugs and cosmetics act, 194o, a misbranded drug is a drug if its label or container or anything accompanying the drug bears any statement, design, or device which makes any false claim for the drug or which is false or misleading in any particular.
other options:
option A: Spurious drugs include drugs manufactured under another drug or manufacturer's name, imitations of other drugs, and drugs with labels from a fictitious company or individual. It also includes drugs substituted partly or wholly by another drug or substance.
option B: Adulterated drugs include those drugs that contain filthy, or decomposed substances, substances that are injurious to health, or if the drug harmful substances to reduce the quality or strength of the drug. It also includes drugs that were prepared in unsanitary conditions.
option C: The term unethical drug is not standard terminology in pharmacology. However, the term ethical drug is sometimes used to describe those drugs that are available only by prescription of a medical practitioner.",,D,
