number,question,options,solution,image_q,answer_key,image_a
Q16,"A 2-year-old child presents to the emergency department with lethargy, difficulty feeding, and dehydration. His vitals are stable and his ECG is shown below. what is the next step in his
management?","a)synchronized cardioversion with 2J of current
b)Adenosine o.1 mg/kg
c)Adenosine o.2 mg/kg
d)synchronized cardioversion with 1J of current","This clinical history along the EKG showing narrow QRS complexes without P waves and pseudo R waves in aVR lead suggests paroxysmal supraventricular tachycardia (PSVT) and the next step  in his management would be an initial dose of adenosine at o.1 mg/kg.
PSVT is a regular, narrow QRS complex tachycardia, most often caused due to an atrioventricular nodal re-entrant circuit. Patients may present with sudden onset palpitations, dizziness, and
diaphoresis.
Management involves slowing AV node conduction and vagal maneuvers (e.g., Valsalva maneuver, splashing cold water on the face) are the first step. If this does not work, intravenous (IV)
adenosine is the drug of choice used to terminate the majority of PSVT episodes.
Adenosine is a very short-acting endogenous purine signal molecule. It is administered as a 6 mg
IV bolus over 2-3 seconds followed by a rapid flush with 2o mL NS. It can be followed up with a
12 mg IV bolus dose if required. It causes membrane hyperpolarization of cardiac muscle cells to terminate the re-entrant circuit through the AV node.
Since the action of the drug lasts for less than a minute, adverse effects are short-lived. These
include transient shortness of breath, chest pain, hypotension, and cutaneous flushing due to
vasodilation. It can however precipitate bronchospasm in asthmatics and verapamil is preferred in such patients.


when the patient is hemodynamically unstable, i.e., hypotension with unconsciousness or respiratory distress, QRS-synchronous direct current cardioversion is done.


The given ECG shows pseudo R' waves:",,KEY NOT FOUND,1328-801.PNG;1329-803.PNG;1329-802.PNG
Q17,which of the following drugs when added with erythromycin can lead to torsades de pointes?,"a)Doxylamine
b)Loratidine
c)promethazine
d)Astemizole","Among the given drugs, astemizole increases the risk of Torsades de pointes when used concomitantly with erythromycin.
Drugs that block potassium channels and prolong QT increase arrhythmogenic potential.
Astemizole is a second-generation antihistamine that blocks delayed potassium channels and prolongs the QT interval.

other options:
option A: Doxylamine is an antihistamine commonly used as a short-term treatment for
insomnia. It is combined with pyridoxine (vitamin B6) to treat nausea and vomiting during pregnancy (morning sickness). It does not prolong the QT interval.
option B: Loratadine is a second-generation antihistamine used to treat allergic rhinitis (hay
fever) and urticaria (hives). It is known for being non-sedating due to its minimal penetration into the central nervous system. It does not prolong the QT interval.
option c: promethazine is a first-generation antihistamine with multiple uses, including the
treatment of allergies, motion sickness, nausea and vomiting, and as a sedative or sleep aid. It also has antiemetic properties and is sometimes used in the management of postoperative nausea and  vomiting.",,KEY NOT FOUND,
Q18,A child was started on ciclesonide inhalational therapy for bronchial asthma. which of the following statements is incorrect regarding his treatment?,"a)It has fewer side effects compared to other inhalational steroids
b)It is a prodrug metabolised by bronchial esterase
c)The occurence of oral candidiasis is more compared to other inhaled steroids
d)oral bioavailability is negligible","The incorrect statement is option c as ciclesonide has a lower risk of oral candidiasis as compared to other inhaled steroids.
ciclesonide is an inhaled corticosteroid that is unique because it is a prodrug. It is metabolised by bronchial esterases in the lungs to its active form, which allows for targeted action within the
airways. This feature reduces systemic side effects and the risk of local side effects, such as oral candidiasis (thrush), compared to other inhaled steroids.
other options:
option A: ciclesonide's activation in the lungs minimises systemic absorption, leading to fewer side effects.
option B: ciclesonide is inactive until it is converted to its active form in the lungs.
option D: Due to its prodrug nature and metabolism in the lungs, ciclesonide has low oral bioavailability, reducing systemic exposure.",,KEY NOT FOUND,
Q19,"A patient diagnosed with hypertriglyceridemia was started on a medication, following which, he developed flushing, hyperglycemia, and elevated liver enzymes. Identify the drug
consumed by the patient.","a)Nicotinamide
b)Rosuvastatin
c)Ezetemibe
d)Fenofibrate","The drug most likely responsible for causing flushing, hyperglycemia, and elevated liver enzymes in a patient being treated for hypertriglyceridemia is Nicotinamide (Niacin).
Niacin (nicotinic acid), is commonly used to treat hypertriglyceridemia and hypercholesterolemia. However, it is associated with side effects such as flushing, which is due to
prostaglandin-mediated vasodilation. Niacin can also lead to hyperglycemia by impairing insulin sensitivity and may cause elevated liver enzymes, indicating potential hepatotoxicity.
other options:
option B: Rosuvastatin is a statin, primarily used to lower LDL cholesterol, and while it may elevate liver enzymes, it is less commonly associated with flushing and hyperglycemia. It can cause myopathy in patients.

option C: Ezetimibe inhibits cholesterol absorption in the intestines and is not typically associated with these side effects.
option D: Fenofibrate is used to lower triglycerides can elevate liver enzymes and can increase the risk of developing myopathy if used concomitantly with statins, but it does not commonly cause
flushing or hyperglycemia.",,KEY NOT FOUND,
Q20,which of the following reasons best explains the combination of Atropine (o.o25 mg) and Diphenoxylate (2.5 mg) for treating secretory diarrhoea?,"a)Atropine potentiates the action of smooth muscle relaxation
b)It prevents overdose and abuse of Diphenoxylate
c)It antagonizes the side effect of Diphenoxylate
d)Atropine increases the antimotility action of diphenoxylate","Atropine is included in combination with diphenoxylate to prevent abuse and overdose of diphenoxylate.
Diphenoxylate is structurally similar to opioids and has the potential for misuse at higher doses. Additionally, it crosses the blood-brain barrier, making it more likely to cause dependence. The
anticholinergic effects of atropine (e.g., dry mouth, tachycardia, blurred vision) become prominent at higher doses, discouraging overdose.
Diphenoxylate is an opioid agonist primarily used as an antidiarrheal agent. It works by slowing down intestinal motility, allowing more time for water and electrolytes to be absorbed from the  intestines, which helps reduce diarrhea. However, because of its structural similarity to opioids, diphenoxylate has the potential for abuse and dependence if taken in large doses.",,KEY NOT FOUND,
Q21,"A hypertensive patient is started on a drug to control his Bp. He had complaints of dry
mouth, drowsiness, and confusion after taking this drug, but he still continued to take the    drug for 1 year. He had to travel abroad for work, and he forgot to take his medications. He now presents with a blood pressure of 2oo/12ommHg. Identify the drug he was on?","a)Amlodipine
b)Atenolol
c)clonidine
d)Enalapril","The adverse effects seen in this patient and the presentation of rebound hypertension on sudden drug withdrawal indicate that the drug is clonidine.
Clonidine is an alpha-2 receptor agonist and a centrally-acting antihypertensive agent. It treats high blood pressure by stimulating presynaptic α2 receptors in the vasomotor center in the
brainstem. This binding has a sympatholytic effect, by suppressing the release of norepinephrine and other sympathomimetics.
Abrupt withdrawal after long-term therapy can result in rebound hypertension, restlessness, and sympathetic overactivity. Dry mouth and sedation are the major side effects of clonidine. It can    also cause impotency and constipation. Rebound hypertension is a potentially serious
complication and occurs if the drug is missed for 1–2 days. This is associated with an alarming rise in blood pressure which may be more than the pretreatment level.
phentolamine is used for the control of hypertension due to clonidine withdrawal.",,KEY NOT FOUND,
Q22,In which phase of clinical trials is drug dosing done?,"a)phase I
b)phase II
c)Phase III
d)Phase IV","The dosing of a new drug is tested in phase I of a clinical trial.
phase I trials are usually performed on healthy volunteers to check the safety and
pharmacokinetic properties of a drug. The participants in this phase do not gain any direct health benefits from taking part. They are generally paid a fee for their time, with the payments being

regulated and not related to the risk involved.
In clinical trials, drug dosing typically occurs in Phase I, where researchers establish the optimal    dose to achieve desired effects while minimizing side effects. In these phases, they focus on safety, tolerability, and pharmacokinetics.
Dose-ranging, primarily conducted in Phase II trials, involves testing multiple doses to identify
the most effective and safe dose range. This phase helps determine the minimum effective dose
and maximum tolerated dose, providing critical data for subsequent studies in Phase 3, where the chosen dose is tested for efficacy and safety in a larger population.",,KEY NOT FOUND,
Q23,A patient with a gynecological malignancy is started on Methotrexate. Later she develops oral and gastric ulcers. which nucleotide synthesis is affected in her?,"a)UDP
b)CTP
c)TMP
d)GMP","TMP synthesis is affected due to methotrexate.
Methotrexate inhibits dihydrofolate reductase (DHFR), which is required to synthesize
tetrahydrofolate. Tetrahydrofolate is essential for converting duMP to dTMP (thymidine
monophosphate) in the nucleotide synthesis pathway. Therefore, the nucleotide synthesis affected in this patient is TMP (thymidine monophosphate).
By inhibiting DHFR, methotrexate reduces the availability of THF, thereby disrupting the production of thymidylate (TMP), which is necessary for DNA replication and repair. This disruption leads to impaired DNA synthesis in rapidly dividing cells, such as cancer cells.
However, it also affects other rapidly dividing cells, including those in the gastrointestinal tract and oral mucosa, leading to side effects like oral and gastric ulcers.",,KEY NOT FOUND,
Q24,The drug 'x' is a GHRH analogue that is FDA-approved for the treatment of HIV-associated lipodystrophy and not used for Growth hormone deficiency. Identify the drug 'x'.,"a)octreotide
b)somatropin
c)Tesamorelin
d)Mecasermin","Tesamorelin is approved for use in HIV-associated lipodystrophy but not for GH deficiency. It is a synthetic N-terminal modified form of human GHRH. It does not get degraded by dipeptidyl
peptidase 4 and therefore has a longer duration of action.

It increases the levels of growth hormone (GH) and insulin-like growth factor (IGF-1) but reduces visceral fat accumulation.
Tesamorelin is approved for use in HIV-associated lipodystrophy but not for GH deficiency. other options:
option A: octreotide is a somatostatin analogue that decreases growth hormone levels. It is used in the treatment of acromegaly, variceal bleeding, diarrhoea due to adenomas secreting VIP
(vasoactive intestinal peptide), and sulfonylurea toxicity. one of its adverse effects is gallstone formation.
option B: somatropin is a growth hormone analogue. It is used in growth hormone deficiency and other short-stature conditions like Turner's syndrome, Noonan syndrome, and Prader-willi
syndrome. Their use is contraindicated in acute critical illness, active malignancy, and proliferative retinopathy.
option D: Mecasermin is a recombinant human IGF-1. It is used in IGF-1 deficiency, growth
hormone receptor defects, and antibodies against growth hormone receptors. Adverse effects
include hypoglycemia and lipohypertrophy. Another recombinant human IGF-1 with its IGFBP-3, mecasermin rinfabate has been FDA-approved for HIV-associated adipose redistribution
syndrome.",,KEY NOT FOUND,
