number,question,options,solution,image_q,answer_key,image_a
53,Match the following antiarrhythmic drugs with their mechanism of action:,"a) 1-d, 2-b, 3-a, 4-c
b) 1-a, 2-c, 3-d, 4-b
c) 1-a, 2-d, 3-b, 4-c
d) 1-d, 2-c, 3-a, 4-b","The correct option is option c: 1-a, 2-d, 3-b, 4-c
Quinidine is a class IA anti-arrhythmic agent. Class 1a agents are sodium channel blockers with significant potassium channel blocking properties. This slows conduction and prolongs the QRS duration and action potential duration.
Digoxin is a Na+ K+ ATPase inhibitor that works by increasing AV node refractoriness.
Esmolol is a ß-receptor-blocker and a class II antiarrhythmic.
Ibutilide is a class III anti-arrhythmic agent. It works by blocking K+ channels.",,C,
54,which of the following drugs increases trabecular outflow?,"a) Timolol
b) Netarsudil
c) Brimonidine
d) Acetazolamide","The drug that increases trabecular outflow is netarsudil.
Netarsudil is a rho-kinase inhibitor used in the treatment and management of glaucoma and ocular hypertension. It lowers the intra-ocular pressure directly through the relaxation of the trabecular meshwork, leading to an increase in aqueous outflow. It also reduces aqueous humor production.
Netarsudil ophthalmic solution is instilled in one drop into the affected eye once daily in the evening. Adverse effects are conjunctival hyperemia, and corneal verticillata.
other options:
option A- Timolol is a non-selective ß-blocker that decreases the IoP by reducing the aqueous humor production through the blockade of the ß-receptors on the ciliary epithelium. ocular adverse effects are allergy, decreased corneal sensation, and punctate keratitis.
option C- Brimonidine is a selective alpha-2 agonist which decreases aqueous synthesis and increases uveoscleral outflow. It can cross the blood-brain barrier and, hence, causes drowsiness and CNS depression. It is contraindicated in infants and children.
option D- Acetazolamide is a topical carbonic anhydrase inhibitor that decreases IoP by reducing aqueous formation. The main adverse effect is the bitter taste following administration. It is contraindicated in people with allergies to sulfonamide antibiotics.",,B,
55,Finasteride is used to treat male-pattern baldness acts by inhibiting which of the following enzymes?,"a) Aromatase
b) 17-hydrolase
c) 5-alpha reductase
d) phosphodiesterase","Finasteride is used to treat male pattern baldness acts by inhibiting 5-alpha reductase.
Finasteride is a competitive inhibitor of the 5-alpha-reductase enzyme that inhibits the conversion of testosterone into its active form dihydrotestosterone (DHT).
Finasteride inhibits type 2 5-alpha reductase within the hair follicle and reduces the production of DHT. Hence, it is used in the treatment of male pattern hair loss. But, new hair growth will be lost when finasteride is discontinued, similar to minoxidil.
on long-term use (nearly 6 months), it produces an effect by reducing prostatic epithelial cell proliferation, thereby reducing the size of the prostate and improving urine flow.
Adverse effects of finasteride:
• Decreased libido
• Erectile dysfunction
• Ejaculation disorder and decreased ejaculate volume
Finasteride is highly teratogenic and pregnant women should not be exposed to the drug because of the potential for inducing genital abnormalities in male fetuses.",,C,
56,Rituximab is a:,"a) polyclonal antibody which acts against CD2o
b) polyclonal antibody which acts against CD5o
c) Monoclonal antibody which acts against CD2o
d) Monoclonal antibody which acts against CD5o","Rituximab is a monoclonal antibody that acts against CD2o B-cell antigen expressed on the surface of B-lymphocytes, plasma cells, and B-cell lymphomas.
It promotes apoptosis through transmembrane signalling as well as by antibody dependent and complement dependent cytotoxicity. It is used in the treatment of B-cell lymphoma, non-Hodgkin lymphoma, and chronic lymphocytic leukemia. It can be used both as a single agent as well as in combination with cytotoxic chemotherapy.
Adverse effects are infusion reactions like chills, fever, urticarial rashes, pruritus, dyspnea, and hypotension. pretreatment with antihistaminics and corticosteroids prevents the reactions.",,C,
57,A new drug application is filed after which phase of clinical trials?,"a) 4
b) 3
c) 2
d) 1","New drug application is filed after phase 3 of clinical trials.
other options:
option A: phase 4 clinical trials are also called post-marketing surveillance.
option C: phase 2 trials are the first round of trials in patients.
option D: phase 1 trials are done in healthy volunteers.",,B,
