number,question,options,solution,image_q,answer_key,image_a
36,Match the following drugs with the targets of their actions.,"a) A-2, B-3 , C-1 , D-4
b) A-4, B-3 , C-1 , D-2
c) A-3, B-4 , C-2 , D-1
d) A-4, B-3 , C-2 , D-1","The correct pairs are as follows:
Trastuzumab is a humanized monoclonal antibody against the external domain of HER2/neu. It is indicated as an adjuvant in the management of metastatic HER-2-positive breast cancer.
Infliximab binds with high affinity to TNF-a and prevents the cytokine from binding to its receptors. Infliximab is used for the treatment of rheumatoid arthritis; it is used in combination with methotrexate in patients who do not respond to methotrexate alone. Infliximab is also used for the treatment of the symptoms of moderate-to-severe Crohn's disease.
sirolimus is an antimetabolic and antiproliferative drug. It acts by forming a complex with an immunophilin called FKBP-12, which in turn inhibits the mammalian target of rapamycin (mToR). mToR is a protein kinase that blocks cell cycle progression at the G1 phase to s phase transition. It is used in the prophylaxis of organ transplant rejection.
Imatinib is a first-generation tyrosine kinase inhibitor. Imatinib attacks BCR-ABL translocation and is used in chronic myelocytic leukemia. It also inhibits c-kit and produces extended control of GI stromal tumors.
A. Trastuzu mab
4. HER2/neu
B. Inflixima b
3. TNF a
C. sirolimus
2. mToR
D. Imatinib
1. BCR-ABL tyrosine kinas e",,D,
37,A patient is brought with altered sensorium and seizures. Attender shows the laboratory report which reveals elevated transaminases. which of the following can be used in this condition?,"a) Midazolam
b) Diazepam
c) Alprazolam
d) oxazepam","oxazepam can be used in patients with elevated transaminases. It is short-acting and so, can be used in patients with liver impairment or brain damage.
oxazepam is an orally available benzodiazepine used to treat anxiety and alcohol withdrawal states. Hepatic oxidation is decreased in persons with liver disease and the elderly. oxazepam and lorazepam undergo only hepatic glucuronidation.
other options:
option A: Midazolam is the benzodiazepine of choice for induction of anesthesia. The onset of anesthesia is within 3o to 6o seconds. It can also be used to control seizures, but there is no difference in the efficacy of intravenous midazolam and intravenous diazepam.
option B: Diazepam is a long-acting benzodiazepine. It is metabolized in the liver to active metabolites like nordazepam which are long-acting. Diazepam and its long-acting metabolites can accumulate significantly in elderly patients with liver disease and therefore should not be used in such cases.
option C: Alprazolam is metabolized by hepatic oxidation which is significantly decreased in liver impairment and elderly patients.",,D,
38,The lipid profile of a patient who suffered from acute coronary syndrome is given below. what drug can be used to treat this condition?,"a) Fenofibrate 16o mg
b) Rosuvastatin + Fenofibrate
c) Rosuvastatin 1o mg
d) Atorvastatin 8o mg","Atorvastatin 8o mg can be used to treat this condition. The first line of therapy in controlling cholesterol in patients with atherosclerotic cardiovascular disease (ASCVD) is starting a high-intensity statin. High-intensity statins include atorvastatin (4o-8o mg) and rosuvastatin (2o-4o mg).
Statins are competitive inhibitors of HMG-CoA reductase. This leads to a decrease in cholesterol biosynthesis. Statins are also effective in reducing LDL and triglyceride levels.
other options:
option A. Fenofibrate reduces lipoprotein levels by interacting with Peroxisome proliferator-activated receptor (PPAR-a) and stimulating lipoprotein lipase. They are used as drugs of choice for treating hyperlipoproteinemia and severe hypertriglyceridemia (>1ooo mg/dL).
option B. Rosuvastatin and fenofibrate combination was previously used to reduce atherosclerotic cardiovascular disease risk. But recent studies have indicated no change in reduction and hence is not recommended anymore.
option C: Rosuvastatin 1o mg is a low-intensity statin and is mainly used for primary prevention against atherosclerotic cardiovascular disease.",,D,
39,An anti-arrhythmic drug is shown to have the following effect. It is effective in both atrial and ventricular arrhythmias. Identify the drug.,"a) Tocainide
b) propranolol
c) Quinidine
d) Lignocaine","Quinidine is a class IA anti-arrhythmic agent. Class 1a agents are sodium channel blockers with significant potassium channel blocking properties. This slows conduction and prolongs the QRS duration and action potential duration.
Lignocaine and tocainide (options D and A) are class 1b anti-arrhythmic drugs. These are sodium channel blockers that inhibit both inactivated and open sodium channels and can open potassium channels. It reduces phase 4 slope and reduces automaticity. It also alters the excitation threshold.
The below image shows the changes in the action potential of a cardiac muscle when a class 1b anti-arrhythmic drug is used.
class 1c agents like flecainide and propafenone block sodium channels with insignificant potassium channel-blocking properties.
The image below illustrates the action potential changes when a class 1c anti-arrhythmic is used.
option B: propranolol is a ß-receptor-blocker and a class II antiarrhythmic.",1173-766.PNG,C,1204-778.PNG;1205-779.PNG;1205-780.PNG
40,which among the following is the false statement regarding statins?,"a) Although HMG-CoA reductase inhibitors substantially reduce the risk of cardiovascular events, there is mild increase in lipoprotein a (Lpa) levels.
b) These drugs should not be stopped even in severe conditions like injury, surgery, etc.
c) They can be given with verapamil and other enzyme inhibitors.
d) with the long term use, there is slight increase in the incidence of type 2 diabetes mellitus.","The false statement regarding statins is that they can be given with verapamil and other enzyme inhibitors.
statins like atorvastatin and rosuvastatin are metabolized by the cytochrome 3A4 enzymes of the liver. verapamil is a cytochrome 3A4 inhibitor and may interfere with statin degradation. This leads to an increase in serum statin levels. The most important feature of statin toxicity is myopathy. It can present as myalgia but can sometimes also lead to fatal rhabdomyolysis.
statins are the most commonly used hypolipidemic drugs. statins act by inhibiting the rate-limiting HMG-CoA reductase enzyme, which in turn inhibits cholesterol synthesis. They decrease levels of low-density lipoproteins (LDL) and triglycerides and increase the levels of high-density lipoproteins (HDL) in plasma.
other options:
option A: Lipoprotein (lp) a is an LDL molecule that has apolipoprotein b and an additional apolipoprotein a. studies indicate that these molecules are atherogenic and may independently cause cardiovascular disease. Although HMG-CoA reductase inhibitors substantially reduce the risk of cardiovascular events, there is a mild increase in lipoprotein a levels.
option B: statins can be continued during surgery. These drugs have proved to decrease overall mortality due to cardiovascular events. statins also influence inflammatory responses and can be safely used in trauma.
option D: Chronic administration of high statin doses also leads to an increased incidence of type 2 diabetes mellitus.",,C,
41,"Identify the drugs marked as A, B, and C.","a) A - Aspirin, B -vorapaxar, C - prasugrel
b) A - Aspirin, B - Eptifibatide, C - vorapaxar
c) A - Aspirin, B - Eptifibatide, C - prasugrel
d) A - Aspirin, B - prasugrel, C - Eptifibatide","The drugs marked A, B and C are aspirin, eptifibatide, and vorapaxar, respectively.
Aspirin causes inhibition of cyclooxygenase-1 (Cox-1), which would inhibit the formation of thromboxane A2. Thromboxane A2 is an inducer of platelet aggregation and is a potent vasoconstrictor. Hence, inhibition of its formation is responsible for antiplatelet action.
Aspirin is a non-competitive, irreversible inhibitor of the cyclooxygenase (Cox) enzyme. It is a nonselective Cox inhibitor and inhibits both Cox-1 and Cox-2.
Abciximab, tirofiban, and eptifibatide act by blocking Gp IIb/IIIa receptors. They are mainly used during percutaneous coronary intervention for acute coronary syndrome. They carry a high risk of bleeding and can cause thrombocytopenia.
vorapaxar primarily inhibits platelet aggregation caused by thrombin. PAR-1 activation by thrombin contributes to platelet aggregation. vorapaxar is a competitive antagonist of protease-activated receptor-1 (PAR-1). vorapaxar is indicated in combination with aspirin and/or clopidogrel to reduce thromboembolic events in patients with MI or peripheral vascular disease.
Prasugrel is an irreversible P2y12 inhibitor and lasts for the entire lifetime of a platelet.
Prasugrel is a prodrug that is used in patients with acute coronary syndrome who have undergone percutaneous coronary intervention. It reduces the rate of thrombotic cardiovascular events in such patients.",,B,1207-781.PNG
42,which of the following is false regarding disulfiram?,"a) only 3
b) 1, and 3
c) 1, 3, and 4
d) 2, 3, and 4","The wrong statement/s regarding disulfiram is only 3.
Disulfiram is an irreversible inhibitor of both cytosolic and mitochondrial forms of aldehyde dehydrogenase. It is used in behavioral modification for alcohol de-addiction. The principle of action is aversive conditioning (not anti-craving).
Disulfiram can be given only to highly motivated individuals. It should not be administered until the person has abstained from alcohol for at least 12 hours. The disulfiram-alcohol reaction may persist as long as 14 days after the last dose of disulfiram.
Alcohol consumption during disulfiram therapy can lead to increased concentrations of acetaldehyde. This can cause aversive reactions, resulting in flushing, pulsating headache, throbbing pain in the head and neck, nausea, vomiting, rashes, respiratory difficulties, chest pain, and autonomic manifestations.
Disulfiram is usually given in the dose of 25o mg/day (range of 125–5oo mg/day).",,A,
43,G6pD can manifest with which of the following drugs?,"a) primaquine
b) chloroquine
c) penicillin
d) Tetracycline","G6PD deficiency will manifest with primaquine.
G6PD deficiency is an X-linked recessive (XLR) disorder that causes congenital hemolytic anemia due to enzyme deficiency. Hemolysis occurs in conditions of high oxidative stress that are triggered by infections, fava beans, and certain drugs.
G6PD is an enzyme in the hexose monophosphate pathway (HMP) that maintains the cellular levels of NADPH. NADPH then provides reducing equivalents needed for the conversion of oxidized glutathione to reduced glutathione. Reduced glutathione helps neutralize free radicles, protecting against oxidant injury.
clinically, most patients are asymptomatic. some patient develops episodic hemolysis, causing hemolytic anemia, hemoglobinemia, and hemoglobinuria.
Both primaquine and chloroquine cause hemolysis in G6PD-deficient individuals, but hemolysis is rare with chloroquine and it can be used in patients with G6PD deficiency, whereas primaquine is contraindicated in these individuals.
Hematological findings in G6PD deficiency are shown HEINZ BODY AND BITE CELLS
Drugs that carry a risk of clinical hemolysis in persons with G6PD deficiency:
cLAss
DRUGs
Antimalarials
Primaquine >chloroquineDa psone/chlorproguanil
sulphonamides/sulphone s
sulfamethoxazolesulfasalazin e, sulfisoxazole
cLASS
DRUGS
Antibacterial/antibiotics
cotrimoxazole,ciprofloxacin, chloramphenicol, Nalidixic a cid, Norfloxacin,Nitrofuranto in
others
Naphthalene, RasburicaseMe thylene blue",,A,
44,choose the correctly matched pairs regarding the drugs used in schizophrenia:,"a) 1,3
b) 1,4
c) 1,2,4
d) 1,2,3,4","The correct option regarding the drugs used to treat schizophrenia symptoms is option c.
Drugs used to treat schizophrenia can be classified:
• Typical or 1st generation antipsychotics.
• Atypical or 2nd generation antipsychotics.
All typical antipsychotics markedly improve positive symptoms of schizophrenia, which is attributed to their antagonism at the D2 receptor. Some of the drugs included in this class are chlorpromazine and haloperidol.
Atypical antipsychotics are antagonists or inverse agonists at the 5HT2A receptor. 5HT2A antagonism is responsible for reducing negative symptoms in schizophrenia. Some of the drugs that belong to this class are clozapine, aripiprazole, and brexpiprazole.
Atypical antipsychotics have lower extrapyramidal symptoms as compared to typical antipsychotics as the former has a lesser affinity to the D2 receptor. Muscarinic antagonists can be given to decrease the extrapyramidal symptoms. For example, promethazine or hydroxyzine is given for acute muscular dystonia, which is a form of extrapyramidal symptoms.
5HT1A receptor antagonism, not agonism, has been found to reduce food intake and hence reduce body weight.
Aripiprazole and brexpiprazole are atypical antipsychotics that have partial agonist effects at the 5HT1A receptor. They have been approved for the treatment of schizophrenia and as an adjunctive treatment for depression.",,C,
45,"A patient presented with a lesion, as shown in the image below. she is an immunocompromised patient currently on HAART. what are the systemic antifungal drugs that can be added along with the HAART in this patient?","a) Inj. Amphotericin B 4-8 weeks, followed by oral itraconazole
b) Inj. Amphotericin B 8 weeks, followed by oral posaconazole
c) Inj. Fluconazole, followed by oral fluconazole
d) Inj. Amphotericin B, followed by flucytosine","The given clinical scenario is suggestive of mucormycosis. The patient can be given injection amphotericin B for 8 weeks, followed by oral posaconazole.
Mucormycosis is an opportunistic mycosis. It is typically seen in immunocompromised patients and invades blood vessels.
The rhino-orbital-cerebral is the most common form of mucormycosis. patients present with rhinitis, eye or facial pain, and facial numbness, followed by the onset of conjunctival suffusion and swelling along with blurry vision.
Diagnosis is made by biopsy with histopathologic examination. The biopsy shows characteristic wide, ribbon-like aseptate hyphal elements that branch at right angles.
The image below shows biopsy findings seen in mucormycosis:
Treatment of the infection includes 4 steps:
• Initiation of therapy (amphotericin B) as early as possible. Posaconazole can also be used in the management of this condition.
• surgical debridement
• Reversal of underlying conditions and risk factors
• Treatment of underlying malignancy if present
Amphotericin B is a broad-spectrum antifungal. It binds to ergosterol in the fungal membrane and forms pores or channels in the fungal cell membrane. This allows the leakage of cytosolic molecules and ions, leading to a loss of membrane integrity.
other options:
option A: Itraconazole can be used for the treatment of chronic aspergillosis if there is resistance or failure of voriconazole. ketoconazole is used for both dermatophytosis and deep mycosis, but it has been replaced by itraconazole.
option C: Fluconazole is used for the treatment of candidiasis and cryptococcosis.
option D: Amphotericin B in combination with 5-flucytosine is used as induction treatment for cryptococcal meningitis.",,B,1210-782.PNG
46,A patient who is on treatment for hyperlipidemia develops gallstones. what is the mechanism of action of the causative drug that was given to this patient?,"a) Inhibits HMG CoA reductase
b) Activates PPAR alpha
c) Binds to deoxycholic acid
d) Decreases VLDL","The antilipidemic drugs likely to cause gallstones are the peroxisome proliferator-activated receptors (PPARs) that act by activating PPAR alpha.
PPARs are a superfamily of nuclear receptors involved in the regulation of energy homeostasis and metabolic function. It has three subtypes:
• PPARa - reduces triglyceride level
• PPAR? - causes insulin sensitization
• PPARd - enhances fatty acids metabolism
Lipoprotein lipase (LPL) is a key enzyme in the degradation of vLDL. Fibrates bind to PPAR alpha and cause stimulation of lipoprotein lipase enzyme. Increased LPL synthesis enhances the clearance of triglyceride-rich lipoproteins. Additionally, fibrates also stimulate fatty acid oxidation and reduce the expression of apo C-III (inhibitor of lipolysis). All fibrates increase the lithogenicity of bile, thereby increasing the risk of gall stones other options:
Class
HMG- CoA reductase inh ibitors (statins)
Niacin
Bile acid-binding resins
Examples
Lovastatin, atorvastatin
Niacin
Colestipol,colesevelam
Mechanism of action
Inhibits HMG-CoA reduc tase
Decreases the production of vLDLs and the catabo lism of HDLs
Binds to bile acids in the intestinal lumen and incr eases excretion.
Major effects on lipoprot ein levels
Reduces LDL levels
Reduces triglycerides, L DL, and lipoprotein a lev elssignificantincrease H DLlevels
Reduces LDL levels
Important side effects
MyopathyElevations of s erum amino-transferase activityElevation of creati ne kinase activity
Cutaneous vasodilationEl evations in amino-transfe rases levels
ConstipationBloating",,B,
47,The dose-response curve for three drugs in the same tissue is shown in the image below. which of the following statements is true?,"a) Efficacy of drug A is more than that of drug B.
b) Potency of drug B is more than that of drug A.
c) Drug A & drug B are agonists.
d) Drug C is a non-competitive antagonist.","In the given image, drug A & drug B are agonists.
Drugs that bind to physiological receptors and mimic the regulatory effects of endogenous signaling compounds' are agonists. Drugs that are only partially as effective as agonists are partial agonists.
The efficacy of a drug indicates the capacity of a drug to activate a receptor and generate a cellular response. A drug with high efficacy is a full agonist, eliciting a full response at some concentration. A drug with a low intrinsic efficacy will be a partial agonist. Drug A & drug B are agonists (option C) that have the same efficacy (option A), although, at different concentrations.
Drug C does not produce a full response at any concentration, making it a partial agonist. In the presence of a full agonist, a partial agonist behaves like a competitive antagonist (option D).
when two drugs produce equivalent responses, the drug whose dose-response curve lies to the left is said to be the more potent since it requires a lower dose to produce the same effect. Drug A & drug B produce the same action and level of response in the tissue. The curve of drug A on the left indicates that it produces the same response at a lower concentration, making it more potent than drug B (option B).",1176-769.PNG,C,
48,which of the following drugs is a ß2 agonist?,"a) 1, 2, 3
b) 4, 3, 2, 1
c) 1, 2
d) 3, 4","Dipivefrine and dopexamine are ß2-adrenergic receptor agonists.
Dipivefrine causes a decrease in aqueous production and increases outflow. It was used in the treatment of open-angle glaucoma and ocular hypertension but has since been replaced.
Dopexamine is a synthetic analogue related to dopamine with activity at D1 and D2 receptors as well as at ß2 receptors. It is used in patients with severe congestive heart failure, sepsis, and shock.
other options:
B. Fenoldopam is a peripheral D1 agonist with moderate affinity for a2-adrenergic receptors. It is a rapidly acting vasodilator that is used in severe hypertension.
D. Mirabegron is a ß3-adrenergic receptor agonist which is used for bladder incontinence.
Activation of this receptor in the bladder leads to detrusor muscle relaxation and increased bladder capacity. This action prevents voiding and provides relief for those with an overactive bladder and urinary incontinence.",,C,
49,what is the mechanism of action of sildenafil?,"a) Inhibition of 5a-reductase
b) Inhibition of phosphodiesterase-5
c) Release of nitrous oxide radicals
d) Blockage of voltage-gated calcium channels","sildenafil acts by inhibiting phosphodiesterase-5 (PDE-5) and is used in the treatment of erectile dysfunction.
PDE-5 inhibitors cause the accumulation of cGMP in the corpus cavernosum, which leads to the relaxation of smooth muscles of penile arteries that fill the corpus cavernosum, thereby improving erectile function in patients with erectile dysfunction.
In addition to erectile dysfunction, sildenafil can be used in the treatment of pulmonary arterial hypertension.
Adverse effects include headache, flushing, nasal congestion, blue-green tinting of vision, and erections lasting more than 4 hours.
sildenafil is contraindicated in patients using nitrate vasodilators, which could result in dangerously low blood pressure.",,B,
50,Choose the correct options regarding the route of administration and bioavailability.,"a) A,B,D
b) A,C,D
c) A and C
d) A and D","The correct option among the following is A, C, and D.
Bioavailability is defined as the fraction of a drug reaching systemic circulation in an unchanged form after administration by any route. The area under the blood concentration-time curve (AUC) is proportional to the dose and the extent of bioavailability for a drug.
Bioavailability (F) = Quantity of drug reaching systemic circulation/Quantity of drug administered Bioavailability depends on two factors, absorption and 1st pass metabolism. The bioavailability of the drug injected intravenously is 1oo%. But it is lower after oral ingestion because of incomplete absorption and first-pass metabolism in the intestinal wall or liver and lies between 5% to <1oo%. The bioavailability of subcutaneous and intramuscular routes lies between 75% to =1oo%.
The image given below shows the difference between the bioavailability of drugs injected intravenously (IV) and administered per orally (po). Note the area under the respective curves shaded in red and blue colors which represent the absorption of the drug.",,B,1182-770.PNG
51,A hypertensive patient on medication presents with the lab values as shown below. which of the following drugs should be stopped?,"a) Amlodipine
b) Metoprolol
c) Losartan
d) Furosemide","In this hypertensive patient with hyperkalemia, losartan must be stopped.
Losartan is competitive angiotensin I (AT1) receptor antagonist, which binds to the AT1 receptor with high affinity. Uses of losartan are:
• Antihypertensive
• Renoprotective drug in diabetes mellitus
• stroke prophylaxis
• portal hypertension in cirrhosis without compromising renal function
• Anti-aggregant as it is a competitive antagonist of the thromboxane A2 receptor.
Hyperkalemia is an important side effect ofARBs. Losartan appears to be a safe and efficacious agent to lower serum uric acid levels in patients with hyperuricemia.
option A: Gingival hyperplasia and ankle swelling are side effects of calcium channel blockers like amlodipine. Ankle edema occurs due to increased hydrostatic pressure in the capillaries present in the dependent parts of the body. This is due to reflex constriction of postcapillary vessels. other common side effects of amlodipine include headache, dizziness, and abdominal pain.
option B: Metoprolol is a cardioselective beta blocker. cardioselective beta blockers are less likely to cause hyperkalemia as an adverse effect. The risk of metoprolol-induced hyperkalemia is increased if the patient is also diabetic.
option D: Furosemide is a loop diuretic. It acts by inhibiting the Na+-K+-2cl- symporter in the thick ascending limb of the loop of Henle resulting in increased excretion of sodium, potassium, and chloride. Hypokalemia, hyperuricemia, hypocalcemia, and hypomagnesemia are the important side effects.",,C,
52,which of the following is the most effective oral drug in smoking cessation?,"a) varenicline
b) cevimeline
c) Muscarine
d) Atropine","varenicline is the most effective oral drug for smoking cessation.
Nicotine is the principal constituent of tobacco responsible for its addictive behaviour. varenicline works by blocking the effects of nicotine on the brain. It blocks a4, and ß2 nicotinic acetylcholine receptor subtypes and inhibits dopaminergic activation produced by smoking through their partial agonism. It decreases the craving and withdrawal syndrome that occurs with cessation attempts. It prevents nicotine stimulation of the mesolimbic dopamine system associated with nicotine addiction, thus helping to occlude the rewarding effect of smoking.
varenicline is prescribed only to patients 18 years or older. It is taken orally and the dose taken is o.5 mg once daily on days 1 to 3, increased to o.5 mg twice daily on days 4 through 7, and 1 mg twice daily after day 8 for 11 weeks. Therapy should start one week before the target quit date. It can be continued for another 12 weeks (1 mg BD) to maintain abstinence.
The adverse effects include nausea, disturbed sleep, sleepwalking, agitation, drowsiness, and constipation, and may also increase the risk of pancreatitis. varenicline has also been implicated in specific skin syndromes such as stevens-Johnson syndrome, erythema multiforme, and photosensitivity. varenicline can cause renal failure and kidney stones, thus renal function must be monitored.
The FDA has issued a warning about mood and behavioural changes associated with its use, and there is some evidence of increased cardiovascular risk.
cevimeline is a muscarinic agonist with an affinity for both M1 and M3 receptors on the lacrimal and salivary glands. while M1 activation results in increased secretion, M3 activation results in smooth muscle contraction, and expulsion of the secretions. cevimeline enhances lacrimal secretions in sjogren’s syndrome.",,A,
