number,question,options,solution,image_q,answer_key,image_a
Q12,"In a patient with abdominal pain and sterile pyuria, what is the finding shown in the image given?","a)putty kidney
b)Nephrocalcinosis
c)staghorn calculus
d)psoas calcification","A patient with abdominal pain with sterile pyuria and the abdominal X-ray showing homogenous ground glass-like calcification is suggestive of a putty kidney.
The putty kidney is a characteristic finding of genitourinary tuberculosis (GUTB). It is caused by the dissemination of the organism through the bloodstream and is always a secondary TB
(reinfection or reactivation of old TB). Genitourinary TB usually presents as sterile pyuria.
Computed tomography (CT) of the abdomen is the most sensitive modality and is the preferred means of visualizing renal calcifications. Microbiological diagnosis is confirmed by at least 3
consecutive early-morning urine samples showing acid-fast bacilli using Ziehl–Neelsen (ZN) stain and subsequently cultured (gold standard).



GUTB is treated with a short course of anti-tubercular therapy (ATT). Ureteric strictures require double J stenting or percutaneous nephrostomy. Definitive treatment is after 3-6mn ofATT,
where a reconstructive procedure (open surgical repair &gt; balloon dilatation) is performed. In case the kidney is poorly functioning, a nephrectomy is done.


option B: Nephrocalcinosis is the deposition of calcium in the kidney parenchyma or tubules, seen in hypercalcemic conditions like hyperparathyroidism.


option C: staghorn calculus (a triple phosphate stone) is found in urinary tract infections (UTI) by urease-producing pathogens like proteus and is not a cause of sterile pyuria.





option D: psoas calcification is a muscle calcification that develops after acute renal failure and rhabdomyolysis. It is not associated with sterile pyuria.",4912-3067.PNG,A,4927-3074.PNG;4927-3074-1.png;4928-3075.PNG
Q13,A patient was found to have a mass arising from the antrum of the stomach which involves the head of the pancreas and metastasis to the right lobe of the liver. How will you manage this patient?,"a)palliative gastrojejunostomy followed by chemotherapy
b)Radical gastrectomy
c)whipple's procedure
d)Gastrectomy with right hepatectomy","The given clinical scenario of a tumour arising from the pyloric antrum of the stomach which
involves the head of the pancreas with liver metastasis is suggestive of metastatic carcinoma of the stomach and is managed by palliative gastrojejunostomy followed by chemotherapy.
Gastric carcinoma has a higher incidence in Japan and affects men more than women. H.pylori is  a significant association, and other risk factors include smoking and industrial dust ingestion. The most common sites are - the proximal stomach (western countries) and distal stomach (Japan
and the rest of the world).



In the early stages, it usually presents as dyspepsia (non-specific). vomiting and profound weight loss is seen in advanced cases. Endoscopy and biopsy of the lesion (gold standard) are performed to diagnose gastric carcinoma. pre-operative staging is done with contrast-enhanced computed
tomography (CECT) of the abdominal/pelvis. The most important prognostic indicators in gastric cancer are - lymph node involvement and depth of tumor invasion.
Gastric carcinoma is treated with surgical resection with lymphadenectomy. Based on the tumor location, different types of gastrectomy and anastomoses can be performed.
• Billroth I gastrectomy - the lower half of the stomach is removed + cut end of the stomach is anastomosed to the first part of the duodenum.
•  Billroth II gastrectomy - two-thirds of the stomach is removed, the duodenal stump is closed and the stomach is anastomosed to the jejunum.
• Roux-en Y gastrojejunostomy - a loop of jejunum is anastomosed to a proximal gastric pouch







other options:
option B: Radical gastrectomy is done in proximal gastric cancer and linitis plastica.
option c: whipple’s procedure is done for gastric carcinoma that has spread to the head of the pancreas. since the patient already has metastases to the liver, this will not be the preferred
option.
option D: Gastrectomy with right hepatectomy is done in gastric cancer that has hepatic metastasis.",,A,4929-3077.PNG;4929-3076.PNG;4930-3078.PNG
Q14,"A patient underwent cholecystectomy for gallstones over 2 years ago. she now presents with symptoms of obstructive jaundice. Investigation reveals a stone in the common bile duct.
what is the stone most likely to be?","a)Primary
b)secondary
c)Tertiary
d)Retained","This patient has a history of cholecystectomy done for gallstones 2 years ago. Thus, in this patient with choledocholithiasis, the stones found in the common bile duct would most likely be primary  stones.
choledocholithiasis or common bile duct stones are classified based on their point of origin:
• primary stones are brown pigment stones that arise de novo in the bile duct and are composed of bile pigments and cholesterol.
• secondary stones (option B) are usually cholesterol stones, which originate in the gall bladder and pass down into the common bile duct. since this patient has already undergone
cholecystectomy more than 2 years ago, secondary stones are unlikely.
• when stones are found in the common bile duct within 2 years of history of cholecystectomy, they are termed retained stones (option D).
• If they are found more than 2 years after cholecystectomy, they are known as recurrent stones (which are mostly primary).
clinical features: Mostly clinically silent, but may present with biliary colic and even obstructive    jaundice. when there is fever, jaundice, and associated right upper quadrant abdominal pain, it is known as charcot’s triad, seen in cholangitis.



Management of choledocholithiasis:
ERCP +/- sphincterotomy followed by laparoscopic cholecystectomy is the most preferred management of choledocholithiasis.
If stones cannot be removed through ERCP and sphincterotomy, then common bile duct
exploration is carried out intraoperatively either in an open procedure or via laparoscopy. A T-tube is left in place after choledochotomy.",,A,
Q15,A 7o-year-old female patient presents with pain in the thigh during walking. Investigation reveals the following finding as given below. what will be the best surgical management?,"a)PTA with stenting
b)Iliofemoral bypass
c)Aortofemoral bypass
d)Aorto-iliac bypass","The symptom of pain in the thigh while walking and the given angiography image showing
common iliac artery obstruction is suggestive of peripheral obstructive vascular disease with
aortoiliac obstruction. The best surgical course, in this case, is to perform an aortofemoral bypass.
Clinical findings of aortoiliac obstruction are :
• Intermittent claudication is the debilitating cramp-like pain felt in the buttocks, leg, and thigh muscles due to reduced blood flow.
• Femoral and distal pulses are absent in both limbs.
• Arterial bruit is heard over the aortoiliac region.
• Impotence (Leriche syndrome) may occur. Buttock claudication is present.
As the disease progresses, rest pain, ulceration, gangrene, and slow capillary refilling may be seen.
CT angiography (CTA) and MR angiography (MRA) are specific investigations. Doppler
ultrasound, duplex scanning, and digital subtraction percutaneous angiography (DSA) are the other available investigations.
An aortofemoral bypass is the choice of surgical intervention in aortoiliac obstruction. Dacron graft is a collagen-impregnated, knitted graft that is used to perform the proximal aortic
anastomosis in aortofemoral bypass. It can also be used in aortic valve repair. In unfit patients, axillofemoral bypass may be done.
other options:
option A: Percutaneous Transluminal Angioplasty (PTA) is most useful in the treatment of isolated iliac stenoses (&lt;4cm in length) than in occlusive disease.
option B: Iliofemoral bypass is done in patients with unilateral occlusion of the distal common iliac or external iliac arteries.
option D: Aortoiliac bypass more commonly known as the aortoiliac endarterectomy is rarely performed now a days because of greater blood loss associated with this surgery and greater    sexual dysfunction caused, additionally it is difficult to perform.
Note: Aortofemoral bypass surgery has long-term patency of 7o-8o% at 1oyears and is often done bilaterally as the occlusion is more likely to be bilateral with one side affected more severely than  the other. Bilateral aortofemoral bypass does not add to physiological stress and has equal
benefits comparatively.",4913-3068.PNG,C,
Q16,"A young air-hostess presented to the outpatient department with dilated veins on her left leg (image). According to the CEAP classification for varicose veins, what will be the C stage in    this patient?","a)C2A
b)C2s
c)C4a
d)C1","The image above shows dilated, tortuous veins of the lower limb. In asymptomatic patients, they are classified as C2A according to the Clinical-Etiology-Anatomy-pathophysiology (CEAp)
classification for chronic venous disorders.
varicose veins are characterized by the tortuous dilatation of subcutaneous veins resulting from
venous insufficiency. patients have heaviness, burning, and aching over the affected area or whole limb, which increases throughout the day or on prolonged standing. Compression and elevation
can relieve the symptoms.
Diagnosed by duplex ultrasound and is treated by modalities such as compression, laser ablation, radiofrequency ablation, endovenous glue, ultrasound-guided foam sclerotherapy, and open
surgery.
Image A shows tortuous dilated veins (C2), Image B is atrophie blanche (C4b), and Image C shows fan-shaped telangiectasia (C4c).


The images below show C5 and C6 - healed and active venous ulcers respectively.",4914-3069.PNG,A,4932-3079.PNG;4933-3081.PNG;4933-3080.PNG
Q17,"An alcoholic patient presented with severe abdominal pain. pancreatitis was suspected and a CT scan revealed lesions with fluid collected near the body of the pancreas. which of the
following enzymes is most likely to be elevated in this scenario?","a)serum GGT
b)CEA
c)serum lipase
d)serum bilirubin","In an alcoholic patient with acute pancreatitis, serum lipase is the enzyme most likely to be elevated.
Acute pancreatitis is often caused by gallstones (7o%) or alcoholism (25%). The cardinal symptom is acute-onset severe pain in the upper quadrant of the abdomen. The patient usually presents in    shock (hypotension and tachycardia) and tachypnoea. some may also present with signs of
bleeding into the fascial planes leading to discoloration of the sites involved:
• cullen’s sign: Around the umbilicus
• Grey Turner’s sign: Flanks
• Fox sign: Inguinal region



• Bryant’s sign: Scrotum
The diagnosis is often clinical with a laboratory diagnosis. Though serum amylase (&gt;3 times) is  indicative of pancreatitis, serum lipase is preferred over serum amylase as it is more sensitive and specific. Contrast-enhanced tomography (CECT) of the abdomen can be used to exclude
pancreatitis if in doubt.
The severity of the acute pancreatitis is assessed using the Ranson and Glasgow scoring system ( ≥3 at 48h of onset of pain ). APACHE, SoFA, SAPS, and MoDS can also be used to assess the      severity of pancreatitis in intensive care (ICU) settings.  Pancreatitis is managed conservatively    with initial nasogastric drainage followed by intravenous fluids, analgesia, and frequent
monitoring of vital signs, urine output, and blood gases.
other options:
option A: Serum gamma-glutamyl transferase (GGT) can also be elevated. It is a biomarker for
pancreatic disease and alcohol consumption but is not sensitive and specific to acute pancreatitis.
option B: Carcinoembryonic antigen (CEA), a tumor marker that is elevated in the
adenocarcinoma of the pancreas.
option D: Elevated serum bilirubin is a result of (i) overproduction of bilirubin (E.g: hemolytic anemia) or (ii) impaired uptake by the liver (liver cirrhosis) or (iii) regurgitation of bilirubin
(obstructive jaundice). It is not seen in acute pancreatitis.",,C,
Q18,A 25-year-old patient presents with abdominal pain and fever for 3 days duration. The chest X-ray in the erect position is given below. what will be the most likely diagnosis?,"a)Gastric volvulus
b)Hollow viscus perforation
c)Liver abscess
d)Empyema thoracis","The given clinical scenario of acute abdominal pain and fever with chest X-ray in an erect position showing air under the diaphragm (pneumoperitoneum) is a characteristic of hollow viscus
perforation.
The most common cause of pneumoperitoneum is bowel perforation (&gt;9o% of the cases).
Gastric and posterior duodenal perforations are seen in long-standing cases of peptic ulcers.
Intestinal perforations are seen with ischemia, inflammation, diverticula, or obstruction (E.g:- colonic carcinoma). other causes also include iatrogenic, penetrating injuries, prolonged
mechanical ventilation, peritoneal dialysis, etc.
Perforation of a viscus is a life-threatening condition due to leakage of the enteric contents which can lead to acute bacterial peritonitis.
Clinical features of hollow viscous perforation are due to the developed peritonitis. They include    abdominal pain, nausea, and vomiting. on examination, the patient has tachycardia, tenderness,  rebound tenderness, decreased or absent bowel sounds, and guarding on palpation. Fever may be present.
The patient is initially investigated with an upright chest X-ray which typically shows air beneath the diaphragm. various other signs for pneumoperitoneum in the supine abdominal X-rays are     Rigler’s sign, Cupola sign, falciform ligament sign, football sign, and Doge’s cap sign. However,    CECT is the most sensitive investigation to detect minimal/ suspected pneumoperitoneum along   with the cause and site of perforation.





other options:
option A: Gastric volvulus is a twisting or axial rotation of the stomach along its longitudinal axis (organo-axial) or vertical axis (mesentero-axial). The sudden onset of constant and severe upper    abdominal pain, recurrent retching with the production of little vomitus, and the inability to pass an NG tube constitute the Borchardt triad. plain films of the abdomen reveal a gas-filled viscus in the chest or upper abdomen.


option C: Liver abscess will mostly have the classic presenting symptoms of fever, jaundice, and right upper quadrant pain, with a tenderness to palpation. Chest X-ray findings generally reflect subdiaphragmatic diseases, such as an elevated right hemidiaphragm, right pleural effusion, or   atelectasis.
A chest radiograph shows an air-fluid level in the right upper abdomen (arrow) and multiple nodular opacities in the bilateral lungs (arrowheads)





option D: Empyema thoracis is an infection of the pleural space. An empyema thoracis on a chest X-ray can mimic a pleural effusion or a lung abscess.The fluid is commonly drained completely
with a chest tube or small-bore catheter.
The chest radiograph showing pleural empyema.",4915-3070.PNG,B,4891-3051.PNG;4935-3082.PNG;4936-3084.PNG;4936-3083.PNG
